tawaahidoon hordoftoota kiristoosi mormitoota kiristoosii,1
dhaloota deemtan hin beekne ijoollee musliimaa jirtuu,1
nabiyyi mohaammad ergamaa seexanaati,1
musliimonni koronaan sababii pheenxeetiif biyya keenyatti dhufe jedhan deddeebi'ee dhaga'een ture,1
muslimonni maraatteetti barana musiliimonni maraatteetti,1
warri pheenxee hin turre pheenxee ta'uun carraa carraa kamiinuu caaludha,0
pheenxee harree marga dheeddu jechuudha,1
pheenxeen hin qabdu pheenxee miti torban qorichi koronaa shunkurtii jinjibila jedhee jireenya hammeessee du'e qeesii ortodoksiiti,1
pheenxeen abdii qabdi,0
pheenxeen dhugaarra dhaabbattee jirti,0
pheenxeen ijoollee waaqayyooti,0
daabboo nyaanna farsoo dhugna wangeela hin lallabnu jiru qeesiin,1
hhhhh barsiisonni sobduun warri ortodoksii maariyamiin kadhatti jedhu,1
garaagarummaa pheenxee sagaagaltuu pirootestaantii beektuu laata,1
manni amantaa ortodoksii dhiha oromiyaa jirtu aadaa eenyummaa oromootin afaan uummata keenyatiin tajaajila eegalaa jirti,0
ortodoksii seexanni harma hoosiste jechuudha,1
warri ortodoksii joonjoftuudhaam mee jarana waaqatu nama baatamoo namatu waaqa baata,1
ortodoksii garaa haraqee qeesiin mana hin jiru dhaqee bataskaana dhaquu kanan jibbeef fincaan qeesiitii molokseetu ajeesse,1
waaqa ortodoksii salphoo duwwaa maal maal waaqayyo araramu jaallatanii miti miniliktu godhee,1
walfakkeenya harree pheenxee keessaa tokko harreen seexanni dhufe iyyiti pheenxeenis seexanni dhufe iyyiti,1
harree pheenxeen lammaffaa lamaanuu daaraa gangalatu kkk,1
safuu wallaalummaa gowwummaan ortodoksii ajaa'ibumaam,1
musliimnis ta'ee kiristaanni ortodoksii warreen amantii namaa hin tuqin kabajaadhan amantii hordofaa jirtan ulfaadhaa,0
waldaan ortodoksii waaqayyoon tuffachuu geessetti,1
jarri ortodoksii macaafa qulqulluun deemu kaabaa sanatu joonjessaam obboleessa,1
warri pheenxee yoomitti albaatu pheenxee saree jibbisiisa wanta tokkoyyuu hin beektan,1
islaamummaan amantaa ergamtoota rabbii biraa ergaman hundaati,0
islaamummaan amantii rabbiin hundeeffamte ta'ee amantiin dhugaa biroo hin jirreedha amantaan guutuu hir'ina hin qabne rabbiin amantaalee hundarra caalchisee jira,0
musliima hin amanne hunda qali morma kuti,1
carraa argattan musliima hin ari'aa qabaatii ajjeesaa,1
ollaan amantaa hin amanan taanan waliin waldhaaansoo walqabaa,1
musliima hin adabdan gogaa abiddaan gubaa foon sibiilan kukkutaa,1
musliima hin waliin hin firoominaa qabdan morma kutaa,1
musliimni amantaa nageenya lallabuudha,0
mana amantaa 'n bakka waaqayyoo kadhataniidha bakka walgahiin siyaasaa geggeeffamuudha,0
amantaan pheenxee taphni daa'imman taphatan waluma qixadha lamaanuu qoosaadha,1
raajiin pheenxee suraafel jedhamtu tokko namicha gowwaa maqaan tolasaa hin jedhamu hojii seexanaa diiguu qabda ta'eef afraash jedhamta jedhe,1
jiru parsantiin 99 musliimadha kiristaanni jedhee ilaaluu hin danda'u meencadhaan morma kunna jawaar mohaammad,1
ijoolleen udaan hagdee hudduu qulqulleeffachu hin beeknes raajiidha ofiin jetti ayii pheenxee,1
oromoonni kaabaa kibbaan tokko oromiyaa keessaa pheenxee hundeen buqqisuu qabna,1
argaa pheenxee arraba biraa hin beekan daabiloos bule,1
musliimni shororkeessaa miti hubadhaa,0
pheenxee ta'ee 13 guutuu eebba argachuun dadhabe jaafar guyyaa 3 eebba guddaa argate,1
opdon gaafa dullomteef gaafa aangoo gad dhiiste pheenxee taati akkaa paastarii gooti,1
musliima ta'uun sooressa jannataa nama godha sooressa maallaqaa miti,0
musliimonni mindaan namaaf kennan jaalalaa duwaahii qofa,0
pheenxee namni sammuu qabus namni onnee qabus namni sabaa biyya jaalatus lammaa magarsaa qofa camlaaqqaadha,1
islaamummaan amantii dhugaa nageenya walqixxummaa irratti hundoofte,0
islaamni nama ajjeesa nama qala mirga namaa sarba shororkeessaa,1
seenaa musliimotaa takkaa islaamaatiin duguuggaan sanyii nama irratti raawwatee hin beeku,0
amantiin kiristaanotaa iyyasuus fayyisa jedhu fudhatama hin qabu,1
ulaagaa shororkeessaa ittiin jedhaman 1 abbootii amantii islaamaa waliin suuraa ka'uu,1
ulaagaa shororkeessaa ittiin jedhaman 2 dargaggoonni oromoo heddummaatanii harka walqabatanii waliin deemuu,1
kkk pheenxeen maraattee dhiisaa,1
paastarii warri ofiin jettan dhugaan jalaa badeyyuu afaan qabadhaa taa'aa,1
afaan aadaa uffata alaabaa eenyummaa keenyan amantaa waaqeffanna,0
dogongoraa soba macaafa qulqulluu soba 1ffaa yesuus haadha dubartii nanna jedhee waame jedhu soba,1
yesuusif waaqayyo walqixa waaqayyo foon uffatee nama fakkaatee teessoo isaarraa fayyisuuf lafaatti gadi bu'e jedhu dubbii sobaati,1
wanti waaqayyoon fakkaatu wanti waaqayyoon qixxaatus gonkuma hin jiru,0
amantaa kanarraa jiran nan arga sobdoota prootestaantii hin agarre,1
uummanni islaamaa amanamummaan qabatamaa mirkanaa'aa hattoota prootestaantii miti,1
kiristaanni islaamni obboleewwani sheexana pheenxeetu adda baasa jira,1
pheenxeen hattuudha,1
arraba prootestaantii waraanan seexanni biyya jeequ hin dhiisu,1
pheenxee sareen tokkuma lamaanuu kosiidha,1
pheenxee ilmaan harree jechuudha,1
pheenxee harree sareen maaf kurrifachuu jaalatuu kkkkk,1
biyya rakkise koronaa hin pheenxee hattuudha rakkoo tahan,1
mee hojii pheenxee ilaalaa soba jaraa,1
soba pheenxe saaxiluun fufa,1
biyya diigaa jiru hafuura pheenxeedha,1
pheenxeen amantaa nagaa lallabu miti,1
koronaa koronaa caaluu pheenxeedha biyya itoophiyaa,1
mohaammad ergamaa rabbii miti daldalaadha saalbaajii arabaa fidee somaaliyaa gurguraa ture kitaaba seenaa kutaa sagal baruu dandeenyee jirra,1
warri pheenxee uffata lubaa uffatanii luba fakkaachuun sobanii dubbii lubni dubbachuuf hin dubbatanii qeesota arrabsiisu,1
soba pheenxee dhaggeeffadhaa,1
salphina pheenxee soba pheenxee dhaggeeffadhaa,1
uummanni pheenxee hedduu nama kofalchiisan dhugaa,1
yeroon soba pheentotaa argu hunda nin kofala,1
wayi salphina pheenxee,1
soba pheenxee saaxiluun fufetti jira,1
pheenxeen soba dhugaarraa dhugaa tokkollee hin makin akkanatti soba wal barsiisaa oolu,1
namni sobuun sadarkaa duraaarra jiru peenxee qofa haga yoona amantiin sobuun sadarkaa duraarraa jiru pheenxee qofa ammaa,1
dhugaa jette sobni pheenxee daanga hin qabu,1
warri iyyasuus gooftadha jettu hundi abiddatti gatamu,1
nabiyyiin pheenxeetiif adurreen biyya arabaa maaliif sisii peestaalii baayyatu bushaa'ota,1
warri pheenxee ofiin jedhu hundi najisa,1
pheenxeen uummata dukkana jiru,1
amantiin namaafi rabbi biratti jibbamu amantii pheenxee qoonxee qofa,1
yaa kaniin jedhu uummanni pheenxee ofiin jedhu horii dhala namaati,1
uummanni pheenxee gowwaa horiiti,1
wallaahi uummata seexanni pheenxee jira,1
lalaa mee pheenxee hojii keessaan uummata najisa uummata macaafa qulqulluu kanattuu kabaja hin goone,1
paasteriin pheenxee tokko jedhetti macaafni qulqulluun harkatti qabadhee jiru akkan shamarran paantii baase hudduu quba kahu ajaje jedha,1
iyyasuus dullatti shawaa takka gudeede magan,1
hordoftoonni amantii islaamaa baga geessan mubaark obboloota,0
hafuuraa qulqulluu waaqayyoottin durbummaa badee siifin deebisa jedhee paasteriin intaloo tokko dhungachaa,1
manni amantaa ortodooksii seera mataa qaba,0
manni amantaa musliimaa seera mataa qaba achi jalatti awwaalamu musliimota qofadha,0
manni amantaa pirootestaantiis seera mataa qaba achi jalatti awwaalamu prootestaantii qofadha,0
mana amantaa gubaa jiru musliimadha,1
pheenxee duuka buutuu yesuusidha,0
pheenxee qoricha addunyaa kanaati,0
eeyyee ammas nan dubbadha pheenxeen qoricha addunyaa kanaati,0
pheenxeen yesuusin gooftaa biraa hin qabnu,0
buutonni pheenxee abboonni amantaa sabboontota eenyummaa amantiitin hin sharafnedha,0
oromoon yesuus jettee rakkisti yesuus israa'eel qofaaf biroof hin ergamne jedha,1
yesuus gooftaa miti yesuus nabiyyii rabbiiti,0
dammaqi dammaqi dhugaan galuu ija qalbii sirriitti banadhuu ilaali hundaaf galuu baatus tokko galaa yesuus nama waaqa miti,0
waaqayyoon hin dhalatu,0
waaqayyoon hin dhalchu,0
waaqayyoon haadha manaa hin qabu,0
waaqayyoon hin rafu,0
waaqayyoon hin sodaatu,0
waaqayyoon hin dulloomu,0
waaqayyoon hin du'u,0
waaqayyoon tokko qofa,0
waaqayyoon ilma hin qabu,0
ijoollee kiristaanaa qeesota keessantu dhaloota burjaajeessaa ibidda bara baraatiif qopheessaa jira,1
wangeelli sobduudha jechootni jirus wal dhahaadha,1
wangeelli macaafa harka qeesotaatin barreeffame keessattuu qeesota dulloomaniin sammuu dadhabeen barreeffameedha,1
biyyoota amantii kiristaanaa hordofan maaliif sagaagalummaan heddummatti,1
biyyoota amantaa islaamaa hordofan namni sagaagalummaa hojjatu hin jiru,1
wangeelli harka qeesotaatiin barreeffame,1
wangeelli dhugaa yesuus samii bahe addunyaa kanarraa bade,1
dafaa qalbii jijjiiradhaa amantaa musiliimaa koottaa,0
musiliimni amantaa kiristaanaa fudhatu hin jiru,1
waaqeffataan amantaa kiristaanaa fudhatus hin jiru,1
namoonni sammmuu dammaqxuu qabu hundi amantaa dhugaa muliimatti galaa jiru,0
warri musiliimaa ortodoksii waaqeffataa ofiin jedhan sababii abdii dhabaaniif inaaffaa pheenxeetiif oolmaa bultii dhabaniiru,1
pheenxeen biyya bulchuu qabee lubbuun oromoota hedduu badde biyyis diigamte,1
hubadhaa dhiibbaa balleessiin amantii pheenxee irratti adeemsifamaa jiru jalqabe hin se'inaa amantichi biyya seenuu eegaleen dhiibbaan irratti godhamaa ture,0
pheenxota nama hiddaa oolan bofoota waldaa keessaa dhaloota macheesaa oolan,1
pheenxota hattoota,1
pheenxota pheenxummaan isaanumaafuu icciitiin hin galle,1
pheenxota nama hiddaa oolan,1
pheenxota fakkeessoo,1
pheenxota maal dhibdeen jiraatan,1
yaa saroota pheenxee,1
hojiin pheenxee hojii seexanaati,1
yesuus waaqayyoo sobaa ta'uu ragaan wangeeluma,1
amantii qulqulluun islaama qalbii duroomsiti kabaja kenniti,0
jannata boo'uun hin jiru,0
jannata hiraarun hin jiru,0
jannata beelaaf dheebuun hin jiru,0
jannata hamatuu walitti yaaduun hin jiru,0
jannata wal tuffachuun hin jiru,0
walumaa galatti jannata nama gammachiisu nama gaddisiisu hin jiru,0
harreen sheexana arge pheenxenis yeruma sheexanni dhufte garaagarummaan jiru hin jiru,1
yaa pheenxota mee maaluma taatan maaliif sagalee waaqayyoo mormitu,1
pheenxonni maalumaaf sagalee waaqayyoo mormanii,1
waaqayyoon kiristaanaa tolchamas kufas caccaphas bitamas kkkkkkk,1
yaa pheenxee rabbiin kennu sammuu ittiin yaadu,1
warri irreecha kabaju horii hin gahu,1
warri irreecha kabaju dhugaa uummanni horii gadi,1
macaafni kiristaanaa lubbuu baasu qofa barsiisa,1
rabbiin tokko miti,0
warri irreecha dhaqu horii hin gahu,1
yesuus hordofuu deemu barumsa barsiise hordofuudha,0
kiristaanonni yesuus hordofna jedhu hordofan yesuus hin phaawulosi,1
yesuus barattoota isaatin hordofa hordoftan gannata hin seentan jedhee barsiisaa ture,0
namni waaqayyoon gammachiisuu danda'u amantii qofani,0
musiliimni jireenya bara baraa dhaquu barbaade yesuusin amanuun kiristaana dhugaa ta'uu qaba jechuudha,1
yesuus cubbamaa miti nama ta'ee dhalateera cubbamaa miti,0
amantiin pheenxee tun nama maraachiti,1
pheenxeen hedduun maraattuudha,1
quraanni kitaaba qulqulluu rabbi buufamedha,0
yesuus yoomiyyuu waaqayyo miti,0
namoonni kiristaana ofiin jedhan baay'ee dhimma iyyasuus gafatan waaqa foon uffataa biyya lafaa dhufeedha jedhu,0
yesuus uumamadha uuma miti,1
tokko hin beektu abiddi waaqayyoo gubu,1
kirstaanonni garaagarummaa waaqayyoo tokkichaa yesuusin addaan baasanii beeku hin dandeenye,1
irreecha hafe amantiin hunduu dhaabbata daldalaati,1
kiristaanni sheexanni worra rabbiin xiiqii qabaniidha,1
rabbiin raamata godhu sheeka,0
pheenxee sobni salphisee balleesuuf deema,1
pheenxonni gaaffilee kitaaba hunda jijjiramu macaafa qulqulluu musiliimonni kaasan bahuuf wangeela jijjiruu haaromsuu fufanii jiru,1
yaa kijiba pheenxee uffee,1
wangeelli shittoodha,0
wangeelli habaabodhaa,0
wangeelli sinboodhaa,0
wangeelli michuu dhugaadha,0
wangeelli jaalallee siirriidha,0
wangeelli ibsaadha,0
wangeelli abdiidha,0
wangeelli buddeena,0
wangeelli masaraa jabaadha,0
wangeelli burqituudha,0
wangeelli kufe kaasa,0
wangeelli bollaa du'aa keessaa baasa,0
warri musliima ofiin jettan waaqayyoo hin beektan beektan mohaammad qofadha,1
warri islaamaa seexanni sammuu dukkaneesseedha,1
ta'uun seexanummaadha,1
salphinni pheenxee fufetti jira,1
dirmaan pheenxee barana baayyee nama dinqa,1
yaa rabbi pheenxee salphifte nun salphisin,1
namichi pheenxee nabiyyii ofiin jedhu hidhamuu ajjeefamuu qaba,1
pheenxeen asirraa waccu tun hundi kitaaba hin beektu paastariin aduun dhihaan baate jedhe amiin jetti,1
amantiin dhugaa islaamummaadha,0
subaan allaah soba pheenxee,1
islaamummaa shirkii shirkeeffachuun dhorgadha,0
pheenxeen kijibduudha ragaa hin qabdu gonkuma,1
pheenxeen seexana isuma garaa kootii dubbatte,1
warri kiristaanaa dhugaa himaan maaltu aarsa soba keessaan namanni irratti beeku hin fakkaatuu,1
kiristaanonni nagayaan musiliimota wajjiin jiraatani nagayaan wajjiin jiraadha,0
kiristaanota musiliimota amantaa islaamaa jibbani gabroonfatuu barbaadan dhukkee kaasaa,1
lammiileen oromoo sumaalee buqqifamanii magaalaa adaamaa ganda qacamaa qubsiifaman sababa musliima ta'aniif qofa kristaanonni manneen kaleessa barbadeessan,1
uummatni kiristaanaa jedhamu uummata yihudaadham bar,1
saphina pheenxotaa kitaaba wangeela jechamu hunda jijjiiramu ilaalla,1
yaa rabbi raajota pheenxee hunda iddoo hundattuu biyya lafaaf akirattillee salphisi,1
oromoon safuu qaba warri peenxee safuus hin beektu,1
dhugaa baanta obboleessa uummanni pheenxee sobduudha,1
macaafa hunda jijjiiramu wangeela jedhamu yesuus mootii biyya lafatiif gibira gabbaraa tureetti dubbata,1
yesuus ergamaa waaqayyooti waaqa miti,1
tokkummaan islaamummaan qur'aanaa haadiisa qofan jirachuufi qaba,1
yesuus jannata nama hin galchu,1
macaafni wangeela jedhamu hunda jijjiirama,1
abbaa jannataa allaah qofa qabadhu,0
musiliimni hin sobu,0
maaliif peenxoonni soba dhugaa fakkeessun nama waaqa fakkeessu yaalu,1
islaamummaa dhugaati macheessa oomishuun daldaluun dhuguun nama biraatiif bitanii kennuun haraama dhorgamadha,0
wangeelli dubbii waaqayyoo miti,1
wangeelli dubbii waaqayyoo miti,1
warri iissaan yesuus kiristoos waaqa jedhu ibiddaati,1
warri kiristaana ofiin jedhu kunneen ragaa tokko yesuus waaqa jedhu,1
yaa kirstaana ofiin jedhu dafii koottuu jannataa,1
manni maree islaamotaa oromiyaa hordoftoota amantichaatiin baga bultii sooma ramadaanaatiif nagaan geessan jedhe,0
pirezdaantiin mana maree islaamota oromiyaa sheeh hajjii ibraahim sagada juma'aafi jama'aa tatamsa'ina vaayirasii koranaa ittisuuf hafe ta'uu ibsuun kadhannaan taraawwii ramadaanaa sagadamus jamaan hin gaggeeffamne himan,0
shirri amantii waaqeffanaa gidiraan waaqeffataa ga'u eenyummaa oromoo balleessuu keessaa angafa,0
amantiin oromoon ganamaa kaasee qabdu amantii waaqeffataa jedhamu qofa ormaati,0
wanni lafarra hin jirreen jira jettee hin amaniin amantiin mallattoo gabrummaati,1
amantaa waaqeffannaatti waaqeffataa ta'uun ta'uudha ta'uun heera uumaati,0
maatii tokko peenxeen jiraate pheenxee manaafiqii jedhama,1
kitaaba qulqulluun rabbiiti jedhanii amanuu oduu duriiti jedhanii bareeda ture,1
gabaabumatti qur'aanni yaada rabbii hin yaada mohammed ta'e mohammed hundumaa tolutti barresse hubachuu dandeenyera,1
xiinxala islaamummaa rabbi jannata dhiiraaf durba 72 qopheesse jedhu,1
qur'aanni hunda dhiira dubartii caalchisee maaliif,1
yesuus madda jireenya bishaan jireenya jalqabaa dhumaa waaqayyoo,0
baayyeetu galateeffamuu barbaada galanni yesuus qofaafi,0
fayyinni yesuus kiristoos duwwaadhan argama,0
yesuusitti amanaa du'a jalas baha hin dhageenye hin argine jechuullee hin danda'amu guyyicha,0
yesuus seexanni taa'uu hin dandeessu duruu,0
amantaa pheenxeen ta'ee wangeelli hin soba,0
namanni dhiira musiliima wajjiin gaaffii deebii jalqabdee harreen waraabessa wajjiin waldhaansoo wal qabde tokkodha,1
waaqayyoo abbaa dhugaati,0
seexanni abbaa sobaati,0
raajota sobduu amantaa pheenxee,1
obboloota musiliimotaa hunda keessanni warri biyya keessaaf biyya alaa baga ittin gahe ramaadaan mubaarak,0
qur'aanni nama amantii biraa hordofu qunnamtan morma dhawaa hin jedhuu,1
qur'aanni nama amantii biraa hordofu morma dhawaa jedhe,1
warri musliimaa rabbiin hunda caalu tolchaniit beeku,0
warri musiliimaa kiristoos fayyisaa ta'uu baruuf qur'aanauma sirriitti dubbisaa qoradhaa innuu himaa,1
namni moo'amee tauu hin beeku warri musliimaa fb si'a 5 guban kufaatii mullisa,1
dhukkubni guddaan addunyaa cubbuu qorichi guddaan cubbuu balleessuu danda'u yesuus ilma waaqayyoo qofadha,0
yesuus cubbuu dhiqeen abjuu karaati hafte,1
pheenxee wallaalummaatu godha amantiin amantii danda'aa miti,1
warri pheenxee seeraaf heera ittin bulmaata hin qabanu ta'eef amantii hunda fakkaachuu fedhu,1
eeyyee wollaahii dhugaa jette amantaa maxxantuu amantaa pheenxee,1
jarri ortodoksii fakkeessaaf akkeessa hin beekanu,0
pheenxee qeenxee jettan baayyeen taajjabne,1
pheenxicha allaahaa dhawaa shaggooyyee tabachiisu pheenxichi allaah dhawaa shaggooyyee taphachiisa,1
ragaa pheenxee keessaa tokko qamadii zaytii fudhatan qofaa,1
musliimaa nama fedhinnaa rabbiif kenne,0
pheenxeen garaa qofaaf jiraatti,1
shamarri pheenxee waahee amantii dubbatte jarri waahee heeruma dubbatu maaliif,1
namani kijiba baruu feete pheenxuma ta'i,1
afuufan pheenxe maal beekti bukoo,1
hordoftoota pheenxee tokkoffaa beera fokkattuu,1
hordoftoota pheenxee lamaffaa beera heeruma dhabde,1
hordoftoota pheenxee sadaffaa nama jiruu fooyyeffatuu dadhabe,1
yaa uumamata oromoo gowwummaa pheenxee namani martuu ilaalaa,1
dhugaa dubbatuuf worri pheenxee waaqaatti ortodoksiif sagaduu qabu,1
abdii fiixee paasterii pheenxee ta'ee,0
oromoon musiliimaa kiristaanaa pheenxee takka amantaa irratti wal hin dhabne ammas wal hin dhabnu olola hin deeminaa dhaabbadhaa,0
musiliimni yesuusitti hin amanne tokkollee hin jiru,1
yesuusitti hin amanne amantii islaamaa hin fudhanne jechuudha,1
soba uummata pheenxee hanaga rabbiin laaffise saaxiluufan jedha,1
amaaraa magaalaa mooxaatti kaleessa galgala finxaaleeyyii amaaraa ortodoksii madraasaa tokko qur'aanaaa kitaabota jiran waliin ibidda qabsiisuun barbaadessanii jiru,1
aboo waaqeffataa hidhuun dhaabbatu,0
waaqeffannaan dhuftee miti amantii gurraachati beekaa,0
pheenxeen jiraatu,0
pheenxee naga busaan namaaf kabaja qaban,0
pheenxee nama kabajan,0
pheenxee jaalala beekan,0
pheenxee lammii jaalatu,0
pheenxee ammantii namaa tuquu hin beekne,0
pheenxee ijjoollee mootummaa waaqayyooti,0
bakka pheenxeen jirtu nagaa guddaatu jira,0
iddoo pheenxeen jiiru kabajatu jira,0
iddoo pheenxeen jiru eenyummaa oromootu jira,0
yaa waaqaaf uumte pheenxee jabbeessii eebbisi,0
gowwaa waahee amantii maal beekta,0
tooftan ittin uummata oromoo saamaa turan keessaa qeesii sheekiin oromoo bakka lamatti qooddachuun nyaachaa turan,1
gaafa bataskaana deemte qeesiin qur'aana balaaleeffachaa taabota qofaan jiraatta jedha,1
gaafa masgiida dhaqxe macaafa jibbaa seenaa arabaa qofaan bocatan,1
sheekonni nama islaama hin tokko ajjeeste jannata galta jedha,1
qeesiin nama musiliima ta'e jibbisiisa,1
amantii alagaa haadha ilmoo adda baasee garagar diigee qeesii sheekii wal jaalachiise,1
sagalee qeesii sheekii dhaga'uu mannaa sagalee sheexanaa dhaga'uu wayya,1
dirqamaan sagalee qeesii sheekii dhageeffachaa hirriiba buluu hin qabnu diddan bataskaana masgiida gubuun boqachiisun dirqama ammuma yaadaa,1
giiftiin durboo maariyam dubartoota hundumaa keessaa filatamteedha jedhe qur'aannis macaafnis dhugaa bahaaf,0
sheekni surree albaatu waaqatu amantii islaamaa oromoof kenne jetti,1
nabiyyii jettu goota arabootaa diina oromootati,1
eenyutu caalaa raayyaa abbaa macaa sheekota,0
namani bakka deemtutti qur'aanaa rabbii jettee odeessitu bakkan argetti ibiddaan guba dhihootti agarsiisa,1
maal qaba waraqaa bixxaashii qur'aanaa rabbiitti jettee ittiin oromoo doorsifti,1
oromoon maal qaba qur'aanaa jechi qur'aanaa jettu afaan arabaati afaan oromoo miti kanuma haagalu,1
ammaan sheekiin ilmaan oromoo goojjoo walitti qabdee amantiin islaamaa amantii oromooti jettu sirreessuu qabdi,1
waaqeffannaan oromoo bakka bu'a,0
raayyaa abbaa maccaas ta'e hudduu yaa banu barbaade takka sodaatu hin jiru,1
amantiin islaamaa amantii arabaa ta'uu araboonnuu ragaa ba'u beekuu qaba namni kamiyyuu,1
ameerikaa biyya diimokraatofte guyyaa qur'aanni gubatutu waggaan qur'aana gubani kabajatu,1
oromoof waaqeffannaan amantii kalaqateetu amantiidha amantiin warruma adiif gurraachaf ta'uu hin danda'u,1
amantiin islaamaa oromoo hin diigaa oromoo hin ijaaru,1
oromoon amantiin islaama ta'e tokko islaama dhiisee saba nagaa ta'uu qaba,1
dallaansuun rabbii jiraatu namni amantii islamaa tuqxu rabbi jahaanamaa mataan gadi gargalchu,1
eeggadhu rabbi jedhe dhiheenyatti duuta inshaa allaah,1
amantii islaamaa araba qofatu hordofa araba ta'ee amantii biraa hordofu hin jiru,1
bada gadhee wayyi qur'aana rabbii irratti tarkaanfii hoomayyuu fudhaachu hin dandeessu,1
ooltee hin buliin lubbuun haala sukkaneessaa ta'een rabbi ajjeesu dabarsu,1
abaarsi rabbi guddaa sirratti bu'u,1
guyyaa qur'aana rabbii jeeqxe amantii islaamaa jeeqxe eegale duuti sittaa dhiyaattu,1
afuftuuu rabbiin dalanisuu ufii qabu sirati buusuu afuuftuu rabbiin dallansuu qabu sirratti buusu,1
amantii islaamaa dhabamsiisuu yaade wallaahi rabbiin addunyaa tanarraa dhabama godhuu,1
qur'aanaa rabbii gubuuf jette rabbi ibidda jahaanamiin gubu,1
yaa pheenxota mee maaluma taatan maaliif sagalee waaqayyoo mormitu,1
ilmaan pheenxee nama bulchuu dhiisii ofiyyuu bulchuu hin dandeessu,1
waldaa gubdanis pheenxee wajjiin waaqayyoo jiruuf pheenxota mo'achuu hin dandeessan,1
maaloo warruma pheenxee dhiirri jiraa beera dulloota heeruma dharraatee,1
yaa wallaalummaa amantaa pheenxee dhaabbataa hin qabdu,1
qabsoon alana ummata musliimaa eeggamu pheenxee amantaa jedhamtu balleessinee dachii rabbii xahaaruu qulqulleessuudha qopheessaa,1
du'aa'ii godhaa aammiin jedhi,0
gabrummaa pheenxee rabbi qabu,1
warri amantii pheenxee hordoftan amantii kanbiraa hoom feetan,0
konsartii pheenxee yesuustu dhufe jedhan,1
dhugaa waaqayyoo pheenxeen maraattee jirti irratti labsii muddamaa irratti labsuun barbaachisee jira,1
dhiitu dhiitamuu tumuu tumamuun seera amantii keenyaati amantiin keenyas pheenxeedha,1
paasteroonni pheenxee dhiiraf dhiira wal fuusisuu eegaltee jirti magan,1
ormoon qeesii hin qabu,1
oromoon paastara hin qabu,1
oromoon sheekii hin qabu,1
waaqeffataa faarsituu aduun dhittee jirti,1
jaallates jibbites iyyasuus kiristoos waaqa keenyadha,0
bara haaraa bara diramaan paasterii pheenxee dhaabbatu rabbiin godhu,1
barri bar salphina paasteroota pheenxee heddu argineedha,1
amantaan tokko dhugaadha jedhamuuf fakkeessuu sobuu bilisa qaba,0
hordoftoonni amantaa pheenxee tokko ortodoksii musiliima fakkeessanii ummata dogoggorsuuf yaalu,1
sammuun duude maali warri musiliimota,1
warri musiliimotaa bitaa mirga jettu mirgaa bitaadha jettu waliin haasa'uun hangafa seexanaa waliin haasa'uudha icci,1
amantiin musiliimaa itoophiyaa gatii badee jiruuf guba miti,1
wangeelli itoophiyaa dhaalera amiin,0
paateroonni pheenxee dhukkubsataa fayyisna jedhan maaliif mana yaalaa dhaqanii dhukkubsataa achi ciisu hin fayyisne,0
islamummaan amantaa dhugaa qajeelaadha,0
karaan islaamummaa tokkichummaa rabbii ergamtootni rabbii hundinuu irratti ergamaniif isuma barsiisaa turaniidha,0
amantaan rabbiin biratti jaalatama filatamaa ta'e amantaa islaamati,0
amantaalee addunyaa kanarra jiran hunda keessaa jaallatama filatamaan amantaa islaamaa qofa,1
amantaa islaamaatiin jiru hundinuu dhumni kasaaraadha,1
islaamummaadhan amantaa biraa namni barbaadu gonkuma hin qeebalamu,0
namni amantaa islaamaatiin jiru islaamummaatti hin deebi'in du'e kasaare jechuudha,0
namni amantaa islaamaa hordofu jannata argatu rabbiin qur'aanaa kabajamaa hime,0
pheenxee ummata sammuu duudaa ilaalaa dalagaa jaraa kkkkkkk,1
addaggeen peenxee maal beekti afaan qabadhu,1
salphina pheenxee sobni fedhe turus hanaga fedhe baayyatus xumurri salphina,1
pheenxonni kunoo kijiba ilaalaa,1
hojiin pheenxee daldala maallaqaa ta'e eenyumtuu ragaa baha,1
nabiyyiin pheenxee kijiba kuntaalaan batee deemu bagauma salphate,1
kaniin jedhu waaqayyoon pheenxee hojii hin qabuyyii,1
warrii phenxee ifittii amanamummaa hin qaban albaatidha,1
kaniin jedhu warri pheenxee yoomitti sobdu,1
paastaroonni pheenxee maaliif balleessu waltajjii garaagaraa qopheessani uummata maallaqaa hin qabne maallaqaa guurrachuuf,1
jarri pheenxee baayyee qur'aanni laaqamadha jedhu ragaa hin qaban,1
pheenxeen yoomuma diraamaa sobaa hojjachuu dhiiftu laata,1
islaamaa hudduu mixmixaatuu jira,1
pheenxeen gowwaadha,1
pheenxeen gaafa maallaqni cite wal saaxilu safuu,1
pheenxeen ummata sooriyaa sababa rakkoon itoophiyaa baqatan akkatti jallisuuf taphataa jirti,1
amantiin waaqeffannaa hin badu,0
amantiin kiristaanaa ta'ee islaamaas ta'ee biroos hin badu,0
waaqeffannaa tumsaa hin dhaabbatina,0
uumanni oromootis amantii mataa waaqeffannaa qofa qaba,0
waaqeffannaa gadaa harkaa laaffisanii amantiin kiristaanaa islaamaa dhufe,1
ormoon qeesii hin qabu,1
ortodooksii minilik ilmaan hangafaaf quxusuudha,1
ortodoksiin dhiiga ilmaan oromoo dhugaa turtee diqaaloonni minilik qeesii daqooniin wacci,1
qeesii arraba dhaanquu,1
qeesiin amantii waliin siyaasa nafxanyummaa leellisu tokkootti wal qixxeessitee ilaaltu qe'een badu,1
dn daani'eel kibret ummata oromoo ortodoksii tahan sababa afaan oromootin amantaa kootan baradha jedheef jeenosaayidii lola duguuggaa sanyii labseera,1
daaqon daani'eel kirbrat oromoota amantaa ortodoksii jiran seexana arrabseera,1
waaqeffataa ta'uun ta'uudha ta'uun heera uumaati,0
mirgi amantii waaqeffannaa kabajamu hordoftoonni amantii waaqeffanna galma waaqeffatanii bakka awwaalaman qabaachuu qabu,0
dabni amantii waaqeffannaa irratti raawwatamu dhaabbachuu qaba,0
amantaan musiliimaa qomoo tokko qofaadha sababni qur'aanni afaan arabaa qofaan barreeffamedha,1
wanti amantaa peenxee amantaa biroo birratii cephasisuu maali,0
pheenxee amantaan jedhamu hin jiru,1
pheenxeen biyya sobaan uummata gowwomsaa jirti,1
warri amantaa pheenxee fudhatu daa'ima tokko hin beekne,1
pheenxee shaneen takkaa dhugaa dubbattee hin beektu,1
warri pheenxee sobuun maaliif barbaachise,1
pheenxee maal beekta keetuu hin beektu,1
wallaalaan pheenxee hin jiru,1
itoophiyaa biyya pheenxeen bulchitu kunoo akkanatti diigamuuf jirti,1
dha'ichi seexanaa pheenxee qoonxee balleessu,1
pheenxee maatu galche keetu hin beektu,1
pheenxee maaltu galche gowwaa,1
