oromoonni kunneen iddoo seenaa sirni miniliik oromoo harmaa harka mure daawwachuun seenaa suukkaneessaa afaanii barreeffamaan dhagahaa turan qaamaan arguun seenaan fokkisaan akkasii lammata ummata oromootti hindeebineef hojjannuu addunyaattis himnuuf gargaara jedhan,0
finfinnee bitootessa 3 2011 fbc dimokraasii dhugoomsuuf qabsoofnef daangaa seeraa namuu yaada bilisaan ibsachuun sirriidha jedhe oromoo demokraatiik paartiin odp,0
mirga oromoon finfinnee qabu ilaalchisee sagaleen dhag'amaa jira,0
mirga oromoo kabachiisuun mirga saba biraa sarbuu miti,0
oromoon mirga kabachiifatuuf hayyama namiituu hin barbaachisu,0
oromoof hunda tokkummaatu tola,0
oromoon sirni ammayyaa hin dhufiin sirna siyaasaa diinagdee hawaasummaa ittiin gaggeeffatu mataasaa qaba,0
qabsoon kaleessa gootota oromoon finiine har'a misooma taeera  obbo shimallis,0
finfinnee caamsaa 27 2013 fbc  preezdaantiin mootummaa oromiyaa obbo shimallis abdiisaan qabsoon kaleessa gootota oromoon finiine har'a misooma taeera jedhan,0
hayyoonni oromoo waltajjii marii gaggeessaniiru,0
finfinnee caamsaa 12 2013 fbc  waltajjiin marii gumii balal marsaa 6ffaan mata duree 'dantaa oromoo horata hawaasummaa jijjiiramaaf' jedhuun waajjira preezdaantii bulchiinsa mootummaa oromiyaatti ta'ameera,0
jijjiirama biyya dhufeef gaheen hayyootaa dargaggoota oromoo olaanaa,0
tarsiimoon biyyattii ture dantaa bu'uuraa uummata oromoof daandii bane hin turree jedhaniiru,0
abbaa jijjiiramichaa ta'e uummata oromoof dantaa kabachiisuun guddina siyaasa diinagdee uummatichi fayyadamaa tauuf hojjechuun barbaachisaa tauu ibsaniirui,0
kitaabnii eenyummaa seenaa oromoo irratti xiyyeeffatuu barreessaa taaboor waamiin barraae eebbifame,0
finfinnee eebila 16 2013 fbc  kitaabnii eenyummaa seenaa oromoo irratti xiyyeeffatuu barreessaa taaboor waamiin barraa'e eebbifameera,0
kitaabni oromoo finfinnee jedhu darajjee bahaaruu margaatiin barreeffame har'a eebbifame,0
gaazexeessitoonni afaan oromoo dimtsa wayyaanee ummata dhiifama gaafatan,0
finfinnee muddee 30 2013 fbc  gaazexeessitoonni afaan oromoon dimtsa wayyaanee dw international irratti hojjetaa turan ummata dhiifama gaafatan,0
oromoon biyyaatti duula aduuwaa qofaan gootummaa mulise hin haras tigiraayitti abut awwaalu godina qellem wallaggaatti shiftoota ergamtoota abut dhumaaf ballessuuf mootummaan olaantummaa seera kabachiisuf hojjechaa jira jedhan,0
waldhabdee oromoo jiru hiikuuf sirni gadaa filannoo jalqabaa tauu qaba  abbaa gadaa goobana hoolaa,0
finfinnee waxabajjii 13 2012 fcb sirni gadaa qabeenya oromoo tauu darbee qabeenya addunyaat jedhaan walitti qabaan gumii abbootii gadaa abbaan gadaa tuulamaa goobana hoolaan,0
oromoon waliisaa gidduutti walitti buiinsi uumamee mitii orma waliinuu rakkoon uumame akkataa furu beekuuf miiyyuu sirna gadaa hordofuu qaba jedhan abbaan gadaa tuulamaa,0
walitti buiinsi obboleeyyan lamaan ittuu karrayyuu gidduutti uumamee guyyaa kaleessaa akkaataa sirna gadaatiin bakka abbootiin gadaa oromoo godinaalee oromiyaa garaagaraa qaamooleen nageenya aangaoonni mootummaa argamanitti aanaa fantaalletti araara argateera,0
muummeen ministira dooktar abiyyi kabajamaa hammataa ummata oromoo hunda baga guyyaa kabaja ayyaana guddaa galateeffannaa jaalala qulqullummaa nageenyaa dhiifamaa araaraa aantummaa namoomaa lallabamu dhugoomu nagaan geessa baga gammaddaan jedhaniiru,0
irreechi sonawwan sirna gadaa keessaa mallattoo nageenyaa tokkummaati,0
sirni gadaa qabeenya guduunfataa ummata oromooti,0
irreechi calaqqee oromummaa keessaa miidhagaa hirmaachisaadha,0
oromummaan har'a dhaabbatanii egeree ijaaruudha,0
oromoon waldhabdee kamiiyyuu gorsaafi mariin furuu filata,0
irreechi mallattoo oromummaa keenyaati qabiyyiyee ijoo ergaa dooktar abiyyi ahimad ayyaana irreechaa sabeeffachuun dabarsan,0
finfinnee fulbaana 23 2012 fbc fedhii faayidaa oromoo kabachiisuuf waliin tarkaanfachuun murteessadha jedhan jaal daawud ibsaan,0
hayyu dureen abo miseensi gaaddisa hoggansa oromoo jaal daawud ibsaan baga irreecha wareegamaan argame geessan jedhaniiru,0
irreechi nagayaan xumuramu ummata oromoo saboota kaanifis waamicha dhiyeessaniiru,0
finfinnee bitootessa 9 2012 fbc  abbootiin gadaa haadholiin siinqee guyyootii araaraa shan labsan,0
abbootiin gadaa haadholiin siinqee kaleessaa eegalee guyyootii kadhannaa araara waaqaa 5 labsan,0
abbaa gadaa goobanaan oromoon aadaa duudhaasaa tikfachuuf durbi buqqee duudaa baattee jaartii cifireen marga jiidhaa qabattee jaarsi cifireen horooroo qabatee dargaggeessi waanjoon waanjee waaqa araara gaafachaa tureera jedhan,0
shira kaayyoo diinaa alaa qindaaeen oromiyaa ummata oromoo irratti agaamamaa jiru deeggarsa ummataatin hin milkaain hafee,0
nyaata aadaa oromoon keessummaa simatuu cidhaa ayyaanaa qopheessu keessaa cuukkoon tokkodha,0
finfinnee fulbaana 9 2012 fbc oromoon injifannoorraa injifannoottii ceaa jiraachuu aanaan preezdaantii mootummaa oromiyaa obbo shimallis abdiisaan ibsan,0
oromoon sadarkaa injifannoo tokkorraa aanutti cee'aa jiraachuuf irreechi finfinneetti barana 2012 kabajamu calaqqeedha,0
oromoon irreecha finfinnee handhuura isaatti sabaa sablammoota ummattoota biyyattii waliin kabajuun injifannoo ulfina malus,0
ayyaanni ireechaa kabajnu dudhaa eenyummaa oromummaa hoomtuu daangessuu hin dandeenye mulatuu tauus himaniiru obbo shimallis,0
oromoon ayyaanaa irreechaa irratti hirmaatu uffata adaa oroomootin faayamuu qabu jedhan,0
finfinnee hagayya 25 2011 fbc  hayyoonni oromoo magaalaa finfinneetti mari'atan,0
dhaabbileen siyaasaa oromoo waltumsanii deeman walsakaalun kufaatii jabaa fida jedhan obbo leencoo lataan,0
obbo jawaar isaanitiin adeemsa qabsoo oromoorratti barreeffama gabaabaa dhiyeessuun kallattii fuula duraa akeekaniiru,0
oromoon walooman tumsamee walsakaaluu keessaa ba'uudhan ofiifis cee'ee biyyas ceesisuu qaba jedhan,0
oromoon tokkummaasaa cimsee deemnan hundaan bakka yaadu qaqqabuu danda'a,0
aadde loomiin oromoon seenaa saboota sablammootaafi ummattoota ollaa isaafi keessoo jiraatan waliin nagaafi jaalalaan ofitti haammatee waliin jiraachuufi jiruufi jireenya hawaasummaa adda addaa waliin gaggeeffachuun duudhaa waliin jireenyaa bara dheeraa qaba jedhaniiru,0
anis ta'e paartin wareegamaa qabsoo oromoo haaluu hin barbaannu jedhan obbo addisuu araggaan,0
odpn injifannoo oromoon argate ummata waliin ta'ee kunuunsaa,0
abo shanee gocha sukkanneessaa lubbuu namaa qabeenyaa gaa jiru aadaa safuu oromoo faalleesuu taeef balaaleeffanna,0
oromoon aadaa wal dandauufi waliin jireenyaa qabuun wanta qabu waliin qooddachuun jiraachuun beekama,0
paartileen siyaasa aktiivistoonni oromoo tokkummaa saba keenyaa cimsuuf wal deeggarree waliin hojjeechuu qabna hundaaol wal dhaggeeffachuun murteessadha,0
jaarmiyaaleen ummata oromootiin qabsa'aa turtan biyyaatti deebitan waliin qabsaa'uufi waliin hojjechuuf seena qabeesaa argachuu obbo lammaan ibsaniiru,0
wallaansoon hiyyummaa moohachuuf goonu aadaaf duudhaa oromoon hammachuun beekkamu dagaagsa,0
beenishaanguul gumuuzitti barnoonni afaan dhaloota afaan oromoon laatamaa jiru lammiileen afaan isaaniin barataniif carraa uumedha  dooktar alamuu simee,0
dooktar alamuu simee wayita beenishaanguul gumuuzitti barnoonni afaan dhaloota afaan oromoon laatamaa jiru lammiileen afaan isaaniin barataniif mirga mirkaneesse tahuu ibsaniiru,0
finfinnee hagayya 10 2011 fbc  oromoon aadaa duudhaa gadaa boonsaa ganamaatin biyya ijaaree dhaloota dhaalchisuun kaayyoo jedhe mootummaan oromiyaa,0
galmi sabboonummaa oromummaa nageenya misooma biyya walqixxummaa guddinni biyyaa sabaa sablammootaa mirkanaa'e ijaarudha,0
oromoon hogganaasaa jaalatu siinqee hulluuqsiseet gaachanaa eeboo kennaaf,0
oromummaan hammattummaadha,0
oromoon biyya bulchuu dandahu hojiin agarsiiseera oromoon deeggarsa kamiiniyyuu ilmaan abbaa gadaa faana dhaabanna,0
ayyaanni irreechaa dhugumaan ayyaana galateeffannaa jaalalaa nageenyaa araaraa dhiifamaa tahuusaa oromoon agarsiiseera,0
oromoon barnooota ammayyaa qaroomina haraa addunyaan fiixee beekumsaa ittiin yaabbate hin qabaatin sirna bulchiinsa walxaxaafi qorannoo waggoota hedduu fudhachuu dandau jiruufi jireenya namaa hedduudhaan gurmeessee hogganu sirna gadaa demokraasii dhugaatiin wal bulachaa dhufee jira,0
oromoon sirna gadaatin buluu bulchachuu eegalee dhaloota kiristoosiin abbaa gadaa goobanaa hoolaa,0
irreecha hora finfinnee hora harsadii bara kabajamuuf qophiin xumuramuu gumiin tokkummaa abbootii gadaa oromoo beeksise,0
oromoon aadaa saba biroo jaallatuufi kabaju saboonniifi sablammoonni biyyattiis ayyaana oromoo waliin ta'uun kabajataniif waamicha dhiheessaniiru,0
sirni gadaan akkaata oromoon jireenya hawaasummaa diinagdee siyaasa aadaa duudhalee qabu hunda ittin gaggeeffatudha,0
abbaan gadaa gujii walitti qabaan gamtaa abbootii gadaa oromoo akkaataa ayyaanni irreechaa kabajamu irratti bakka bu'oota hawaasa godina gujii lixaa waliin mari'ataniiru,0
ayyaana irreechaa hora finfinnee harsadeetti oromootaan kabajamu ilaalchisuun abbaan gadaa gujii walitti qabaan gamtaa abbootii gadaa oromoo abbaan gadaa jiloo maandhoo hawaasa godina gujii lixaa keessaa babahan waliin mari'ataniiru,0
biiroo dhimmoota koominikeeshinii mootummaa oromiyaatti marii abbaan gadaa jiloo maandhoo oromoon kamiyyuu caalaa tokkummaa cimsuu qabu dhaaman,0
ergaan abbootii gadaa oromootiin irreecha sababeeffachuun dabarsan ummanni oromoo hojiirra oolchuu qaba,0
ayyaanni irreechaa ayyaana oromoon tulluu malkaatti ba'uu darbeef uumaa galateeffatu dhufuuf imaanaa kennatudha,0
itoophiyaan biyya oromoo hin eenyutuu ta'uuf rakkatti obbo taayyee dandaaa,0
gaaffii 1ffaa hayyoonni oromoo hidhaa jiran hin hiikamin filannoon baranaa akkamiin geggeeffamuu dandaa,0
gaaffii 2ffaa tokkummaa oromoo irraati hojjachuuf maaltu gufuu tae mootummaan naannooo oromiyaa maaliif mormitootaa waliin hojjachuu dadhabe,0
mootummaan oromiyaa tokkummaan oromoo dantaa oromoo qofaaf hin dantaa itoophiyaafuu utubaa ta'uu hubata,0
gaaffii 4ffaa miidiyaaleen oromoo omn maaliif cufaman,0
miidiyaan omn miidiyaa qabsoo uummata oromoo bakka gudda qabu ta'us jijjiirama du'a artiistii jaallatamaa hacaaluu hundeessaan wal qabatee duras hedduu daangaa bilisummaan yaadaa ibsachuu deddeebin sarbeera,0
ummati oromoo bara hedduuf jeeqamaa turuu namuutu beeka,0
shaneen takkaa diina ajjeesee hin beekne jijjiirama oromoo ajjeesee geeraruu eegale,0
gaaffii 7ffaa gaffiin abba biyyummaa oromon finfinnerraa qabu maal gae,0
gaaffii 15ffaa itiyoophiyaa oromummaan hariiroo qabuu qabaatan seenan oromoo itiyoophiyaa maaliif finxaaleyyiin gadi qabama,0
ummata kuush keessaa guddichi ummata oromooti,0
dhalootumarraa itoophiyaan biyya oromooti,0
seenaa garasuu dhukii abdiisaa aagaa abbichuu bayyanaa qusee diinagdee kkf gaafa ilaallu oromoon ijaarsa tika itoophiyaa adda duree ta'uu hubanna,0
itoophiyaan biyya oromoo hin eenyutuu ta'uuf rakkatti,0
dooktarri kabajaa lammaa magarsaan jaarmiyaan oromoo hunduu walitti qabamnee qalbii miira gaaridhaan saba keenyaaf taa jenne mariachaa turreerra jedhan,0
oromoon alaabaa hin barbaadhu seera hin barbaadu jedhe maalif dhaabbanna,0
marii obbolummaa oromoo amaaraa aadaa waliin jireenyaa saboota lamaanii cimsuu irratti mariatameera,0
mariin abbootii qabeenya oromoo amaaraa finfinneetti gaggeeffame,0
finfinnee sadaasa 4 2012 fbc mariin abbootii qabeenya oromoo amaaraa finfinneetti gaggeeffamaa jiru dhimmoota adda addaarratti marii taasisaniiru,0
dooktar abiyyi koonfaransii nageenyaa abbootiin qabeenyaa oromoo amaaraa galma barkumeetti qopheessanirratti kaleessa galgala argamuun ergaa dabarsaniiru,0
ummanni oromoo amaaraa lakkoofsanis hedduu,0
hariiroo oromoo amaaraa cimsuu jiraattonni oromoo godina walloo ga'ee olaanaa qabu obbo jawaar mahaammad,0
jiraattonni walloo hariiroo amaaraa oromoo cimsuu bakka olaanaa qabanis obbo jawaar ibsaniiru,0
paartiileen siyaasaa oromoo amaaraa ejjennoo siyaasaa waloo irratti waliin hojjechuuf waliigaltee mallatteessan,0
finfinnee caamsaa 10 2011 fbc hayyoonni amaaraa magaalaa finfinnee jiraatan galma gamtaa afrikaatti mari'atan,0
finfinnee eebila 24 2011 fbc amaaraa magaalota adda addaatti hiriirri gaggeeffame,0
finfinnee onkololeessa 21 2013 fbc mariin hariiroo ummattoota oromoofi amaaraa cimsuurratti xiyyeeffate ibsa waloo abbaa qabxii afurii baasuun xumurame,0
mariin hariiroo ummata oromoo amaaraa cimsuufi rakkoolee mudatan mariidhaan furuu irratti xiyyeeffatee kaleessaafi har'a adaamaatti geggeeffamaa ture ibsa ejjennoo abbaa qabxii afurii baasuun xumurame,0
waltajjii obbolummaa saboota oromoo amaaraa guyyaa haraa magaalaa ambootti gaggeeffame irratti waraqaan qorannoo walitti hidhamiinsa seenaa saboota mulisu rakkoolee mudataa jiranii fala fuula duraa irratti xiyyeeffate gaafatamaa waajjira galeessaa odp obbo addisuu araggaa hayyuu seenaa yuunvarsitii finfinnee gargaaraa proofeeseraa abebaaw ayyaalewuun dhiyaatee jira,0
finfinnee sadaasa 11 2012 fbc walgaii mariin nageenya walitti dhufeenya oromoo amaaraa finfinneetti gaggeeffamaa jira,0
finfinnee eebila 13 2011 fbc aanaan preezdaantii mootummaa oromiyaa obbo shimallis abdiisaa waltajjii obbolummaa ummata oromoo amaaraa cimsu guyyaa haraa magaalaa ambootti gaggeeffamaa jiru irratti haasaa taasisaniin jedhanitti tokkummaa ityoophiyaa egsiisuuf calmaatti hojjennu ta'a jedhaniiru,0
ummata oromoo amaaraa tokko taasisuuf qeerroon injifannoo guddaa galmeesisanii jiru,0
dargaggoonni oromiyaa xaanaan jedhanii laga xaanaa inbocii kaasuu irratti hirmaannaa taasisaniin tokkummaa oromaaraa cimsuuf tumsi taasisan hin dagatamne tauus ibsaniiru,0
finfinnee adoolessa 17 2010 fbc hariiron ummata oromoo amaaraa jidduutti muul'achaa jiru fedhii ummataarratti hundaa'e ta'uu hogganaan biiroo dhimmoota koominikeeshinii oromiyaa dooktar nagarii leencoo himan,0
oromoo amaarri ummattoota biyyattii waliin ta'uun nagaa tasgabbiin ityoophiyaa eegamee turu aarsaa barbaachisaa mara kaffalaa turaniiru,0
finfinnee caamsaa 14 2013 fbc  muummeen ministiraa fdri dooktar abiyyi ahimad qaamoolee hawaasa garaagaraa naannoolee tigraayii amaaraa walitti dhufan waliin mariatan,0
hoggantoonni paartii badhaadhinaa godinaalee aanaalee oromiyaa amaaraa waldaangessanii marii waloo taasiisan,0
hoggantoota paartii badhaadhinaa godinaalee aanaalee oromiyaa amaaraa waldaangessan gidduutti mariin waloo taasiifame,0
godinaalee aanaalee oromiyaa amaaraa jidduutti mariin waloo finfinneetti gaggeeffameera,0
ummatni oromoo sabaa sablammoota hammatee jiruudha,0
ummani amaaraa oromoo duudhaa waliin jireenyaa qabu cimsee fufa,0
finfinnee bitootessa 30 2011 fbc mootummaan amaaraa walitti bu'iinsa bulchiinsa godina addaa oromoo walloo shawaa kaabaatti mudateen miidhaa qaqqabeef gadda dhaga'ame ibse,0
preezdaantiin mootummaa amaaraa dooktar ambaachaw makoonnan ibsa eda galgala laataniin beeksisanitti sababiin walitti bu'iinsichaa qoratamaa jira,0
daadhin sirboota qabsoo sabboonummaa oromoo jajjabeessan viidiyoo sagaleedhan maxxansiisuun gumaachaa tureera,0
amantaaleen oromoo biyya keessaaf biyya alaa jiran nagaan waliin jiraataniif jaarmiyaan hundeeffamaa jira,0
mirgi abukaatoo dhaabsifachuu hidhamtoota siyaasaa oromoo molqame,0
tokkummaa dubartoota oromoo kanaadaa uummata oromoo walloo cina dhaabbachuuf jiran ibsan,0
uummatni oromoo uummata kaaba oromiyaa walloo rakkataa jiru tumsuuf qooda eegamu bahatu,0
waraanni bilisummaa oromoo gujii bahaaf oromiyaa bakka adda addaatti tarkaanfii fudhate,0
waraanni bilisummaa oromoo oromiyaa kutaalee adda addaa tarkaanfii diina irratti fudhatu cimsee fufuu isaatu himame,0
barreessaa kitaaba afaan oromoo gaaddiisaa birruu du'aan boqotan,0
barreessaa kitaabilee asoosama afaan oromoo jalqabaa ta'an gaaddisaa birruu waaqaa du'aan boqochuun himame,0
oduu gammachisaa oromoo maraaf,0
beekamu tokko darbeef keelloo miidiyaan hojii miidiyaa dantaa oromoo eegsisuu irratti buuurefamee hojii boonsaa hojechaa ture,0
omn hawaasni oromoo washington dc buufata xiyyaaratti argamuun prof mararaa gudinaa simatan,0
omn fulbaana 16 2020 kabaja ayyaana irreechaa ilaalchisuun gumiin abbootii gadaa oromoo adaamaatti miidiyaaf ibsa kennan,0
gumii abbootii gadaa oromoofi abbaan gadaa jiloo maandhoo ibsa kennan kabajni irreechaa bara nagaafi gammachu hawwuu dubbatanii,0
irreechi baranaa kabajamuuf gumiin abbootii gadaa oromoo murteesseera,0
omn fulbana 20 2020 ummanni oromoo irreecha baranaa baroota darbanitti milkiidhaan irreeffachuu qabu hayyuun aadaa seenaa oromoo tokko yaadachiisan,0
obbo maammoo gadaa uummanni oromoo irreecha baranaa baroota darbanitti irreeffachuu qabu omnitti himanii jiru,0
irreechi oromoof hunda jedhan buleessi qabsoo oromoo maammoo gadaa irreechi aadaa duudhaa safuu qabsoo tokkummaa oromootis hammateedhas jedhan,0
uummanni oromoo dhabe argachuu qaba argate dhabuu hin qabu jedhan obbo maammoon irreechi bara dheengaddaa hora finfinneetti jalqabe baranas bifa uummata oromoo bal'aa hirmaachiseen fufu hora har sadiitis kabajama jedhan,0
bara dheengadda uummanni oromoo naamusaa tasgabbii dinqisiisaan rakkoo homaatuu hin mudatin miidhamni homaatuu hin uumamin ofiisaatifi sabaaf sablammoota biroo hundaa kabajuun haala gaariin finfinnee irreeffatee mirkaneesseef walitti dhufuun oromoo mootummaa yaaddessuu hin qabus jedhan buleessi qabsoo oromoo obbo maammoo gadaa,0
adeemsi jabaa oromoo laamshessuun diinagdee siyaasa sabichaa dadhabsuuf deemamu dhaabbachuu qaba,0
qondaala olaanaa adda biliisummaa oromoo ta'e obbo gadaa gabbisaa guyyaa har'aa mana jireenya isaatti galaa jiruu magaalaa buraayyuu tika mootummaafi poolisiitiin butamuun dhaga'ame,0
qondaalota adda biliisummaa oromoo gameeyyii dargaggoonni ji'oota muraasa hooggansaatti dhufan warreen gadaa gabbisaa lammii beenyaafi dawit abdataafaa hidhamuun paartichi humna haaraatiin hin utubamneef yaalii ijibbaataa mootummaan taasisaa jiru ta'uu agarsiisa haalichi xiinxala hayyootaas argateera,0
omn 12 2020 ummanni oromoo bara dheengaddaa baranas irreecha finfinnee hora har sadillee deemee irreeffatu abdii guutuu qabna jedhan perezedaantiin waldaa maccaa tuulamaa obbo dirribii damisee,0
oromoon bara dheengaddaa baranas irreecha finfinnee hora har sadillee deemee irreeffatu abdanna jedhan perezedaantiin waldaa maccaa tuulamaa obbo dirribii damisee,0
dhiibbaa sirnoota dabraniitiin irreechi qal'atullee oromoon tuulamaa galaan irratti ajjeefamaa irratti reebamaa irratti dhiitamaa irratti hidhamaa dhoksaadhaan irreeffataa dhalootaaf dabarses obbo dirribiin yaadachiisaniiru,0
eenyummaan oromoo ifoomu tokkummaan oromoo jabaatu aadaa abbootii teenyaa irratti cicichine gadaa deebifannee hojjenneedhas,0
irreecha uummanni oromoo nagayaan irreeffatu gochuuf taattaaffin goonu fufa jedhaniiru perezedaantii waldaa maccaa tuulamaa ta'an obbo dirribii damisee,0
oromoon cufti bakka tokkoo ka'ee sagalee tokkoon irreechaaf qopheessuu qabas,0
oromoon malkaa finfinnee hora har sadiitti yaa waaqa bara ajjeechaan oromoo dhaabbatu bara hidhame hiikamu bara araaraa bara nagaa bara mirgi oromoo kabajamu godhi jennee malkaatti irreeffannee kadhannun abdadha yaada goolaban prezedaantiin waldaa maccaa tuulamaa obbo dirribii damisee,0
paartiin izeemaa magaalaa finfinnee keesaatti manni murtii afaan oromootiin tajaajilu hin qabu mana murtii federaalaatti iyyate,0
paartiin izeemaa mootummaa biyya bulchu waliin walitti dhufeenya gaarii qabu magaalaa finfinnee handhuura oromiyaa taatee tajaajilli afaan oromoo kennamuu hin qabu jechuunsaa mufachiise dhalattoonni oromoo finfinnee omn himaniiru,0
hidhamtoonni siyaasaa oromoo mana hidhaa qaallittii zoonii 6ffaafi 8ffaa diddaa nyaata lagachuu fufuu maatiin omn himan,0
addatti hidhamtootni siyaasaa oromoo mana hidhaa qaallittii zoonii 6ffaa obbo jawaar mohammad obbo baqqalaa garbaa obbo haamzaa booranaafi shamsaddiin xahaa diddaa nyaata lagachuu dursanii eegalaniif guyyaa 9ffaa qaqqabuun hedduu miidhamanii jiraachuu maatiin omn himaniiru,0
hidhamtoonni siyaasaa oromoo mana hidhaa qaallittii jiran guyyaa kaleessa dhaddacha irratti sababa diddaa nyaata nyaachuu geggeessaa jiraniif beelaafi dadhabiitiif sagalee waakkiifi amantii kennachuun himata isaanirratti dhihaate faccisuu hin dandeenye xalayyaatiin mana murtiif dhiheessuun yaadatama,0
barattoota oromoo naannoolee amaaraa tigraayitti ramadaman ilaalchisee aktivistoonni oromoo maal jedhu gababaa eegaa,0
addi biliisummaa oromoo ibsa baaseen badhaadhinaan abdii kutateef daaimman waraana buaa hin qabneef bobbaasee yakka hamaa raawwachaa jira jira qeeqe,0
qabsaa'aan mirga ummata oromoo sochii qabsaa'ota baalee gurra jabaa horate koloneel siraaj haaji isaaq sanbata darbe adol 24 2021 baale raayitutti du'aan addunyarraa boqatuun dhagahame,0
koloneel siraaj haaji ishaaq gootota baalee jeneraal waaqoo guutuu jeneraanaal heseen bunee koloneel aliyyii cirrii kanneen biroo wajjiin ta'un qabsoo ummta oromoo tini'isaa turan,0
akaakayyuun sheek ishaaq dadhii tarree jedhaman nama weerare minilik ummata oromoo harargee irratti banee saba ofiitiif gaachana ta'uun anoole irratti gooticha oromoo leenjisoo diigaa wajjiin ta'uudhan lolanii lolchiisaniidha,0
omn maatii koloneel siraaj haaji ishaaq tarreef ummata oromoo maraaf obsaafi jajjabina hawwa,0
hawaasa oromoo magaalaa siyaatil koreen deegarsa omn heddu galatomaa,0
hidhamtonni siyaasaa oromoo mana hidhaa qaallittii diddaa nyaataa geeggeessaa jiran keessaa namni gaggabuun hospitaala seenan tau obbo jawaar mohammad obbo baqalaa garbaa hamzaa booranaa sadarkaa dubbachuu dadhabuu gahan abukaatoon hidhamtootaa obboo kadiir bulloo bilbilaan omn himee jira,0
hidhamtoonni siyaasaa oromoo mirgi ummata oromoo hidhamtootaa kabajamuu lagannaa nyaata jalqaban hara guyyaa 14ffa gahani jiru,0
gaafiin deebii argatutti hin sorannu jedhan hidhamtoonni siyaasaa oromoo jiraannee salphina ummata keenyaa arguu dhumnee dhokachuu wayya ejjannoo jedhutti cichanii diddaa sirna bulchiinsa biltsginnaa irratti argisiisuu fufani jiru,0
ilmaan oromoo qaama nageenyaa rib jirtan qabsoo ummanni oromoo ummatoonni biroo mirga hiree ofiin murteeffachuuf adeemsisaa jiran cinaa dhaabbattan gumii qabsoo oromoo gqo waamicha lammummaa dabarsa,0
gumii qabsoo oromoo waamicha biyyoota ollaa ummata addunyaa jaarmayoota mirga dhala namoomaatiif dabarseen mootummaan federaala itoophiyaa mootummaan tigraay lola dhaaban dhiibbaa gootan gaafate,0
hidhamtoonni siyaasaa haal duree tokko hiikamanii mariin humnoota siyaasaa hundumaa hirmaachise qophaauu filannoon haq qabeessi adeemsifamu gaafate gumii qabsoo oromoo ukkaamsaa bakkoota adda addaatti godhama jiru dhaabu dhiibbaa godhan gafate,0
paartiileen siyaasaa oromoo gurguddaafi gameeyyiin lamaan jechuunis abo kfo'n ibsa haala ilaalchisuun baasaniin uummatni hooggantootasaa du'a jalaa oolfatuuf waamicha dhiheessan,0
filannoo haqa qabeessaan oromoo ceesisuun diimokiraasii qabsiisuuf abdiin paartii keenyaatti qabnu coolligeera jedhu ibsi kfo rakkoo guddaan uumameefi uumamuuf adeemu hin dhufin mootummaan dhimmicha furuuf watwaachaa turres haalota darban yaadachiisa,0
hayyuun oromoo abbaan gaazexaa bariisaa barreessaa galmee jechootaa ulaagaa guuttate jalqabaa ta'an profeesar mahadii hamiid muudee biyya jiraachaa turan usa magaalaa columbus ohio du'aan addunyaa kanarraa boqatan,0
profeesar mahaadii hamid muudee guddina afaan aadaa aartii siyaasaa miidiyaa oromoo hayyuu shoora olaanaa taphachaa turaniidha,0
prof mahaadii hamid muudee hundeessaa gaazexaa afaan oromootiin duraaf bara 1975 maxxanfamuu jalqabe abbaa gaazexaa baariisaati gaazexaa irratti gulaalaa olaanaa ta'uun waggoota 17'f hojjataa turaniiru,0
prof mahaadiin baroota 1970'moota funyaan sirna nama nyaataa taa'uun hojiilee hayyootaa kanneen afaan oromoo irrati dalagaman bal'inaan xinxalluun qorannaa qubee afaan arabaa gi'iizi laatini irratti gaggeessudhaan qubeen laatini afaan oromoo ittiin qubeessuuf mijaawu ta'usaa mirkaneesse,0
qabsoo bilisummaa ummata oromoo gahee guddaa gumaachan obbo bushuraa uloo addunyaa duaan boqotan,0
obboo bushuraan nama sabboona bilisummaa ummatta oromootiif gumaacha guddaa taasisan tauu namoonni seenaa beekan dubbatu,0
bara aadaafi afaan oromoo garmalee hacuucammaa turetti bushuraa uloo sirboota aadaa oromoo warabaanii walti qabuun kuusaa turan,0
bushuraa uloo lola diddaa gabrummaa oromoonni mootummaa dargii iraatti geggeesse gootummaan qooda fudhachuudhaangahee oromummaa bahaniiru,0
obbo bushuraa uloo qabsoo bilisummaa abon gaggeeffamaa ture hirmaannaa guddaa qaban ibsamee jira,0
obbo bushuraa uloo bara chaartaraa general waaqoo guutuu qabsoo fufuuf somaliyaa imaaluun shoora sabboonaa oromoo tokko eegamu qabsoo oromoof gumaachaniiru,0
qeerroon godina shawaa bahaa aanaa zuwaay dugdaa magaalaa maqii barattoonni oromoo hammaataa kanatti amaaraa tigraay deemanii barachuu hin qabne dhaaman,0
danda'ametti mootummaan oromiyaa barattoonni oromoo oromiyaatti barataniif haala mijjeessu qaba,0
weerarri oromoota walloo qonnaan bultootaa horiisee bultoota irratti baname cimee fufeera,1
jiraataan aanaa baatee dubbifne tokko ibsetti humni ergama diinummaa oromoo qabu daangaa darbuun gandoota habilaaloo booraa qal'aa odaa jedhaman ibiddaan gubeera,1
ammaa haalli oromoonni walloo jiran baay'ee yaaddessaa tahuu hime,0
murni humnaan biyyattii bulchaa jiru oromummaa lafarraa balleessuuf abo qabatee karra saaqaa jira,1
haalli hidhamtoota siyaasaa oromoo mana hidhaa qaallittii hedduu yaaddessaafi yaachisaa ta'uu himan qeerroowwan godinaalee oromiyaa garaa garaa uummatni oromoo golee arfanirraan jiru dammaqaa ta'uun hayyootasaa waliin tokummaatiin qabsaa'uu qaba dhaamsa wal fakkaataa dabarsaniiru,0
matakkalitti poolisiin humna addaa amaaraafi waraanni mootummaa ilmaan oromoo dararaa jiraachuu jiraattonni himan,0
godina matakkal aanaalee garaagaraa hawaasni oromoo sababa oromummaa qofaaf 'shanee' jedhuun qaamolee nageenyaa mootummaatiin miidhaaf saaxilamaa jiraachuu omn himatan,1
mallattooleen eenyummaa oromummaa finfinnee magaalota oromiyaa biroottis babal'achuu qabu,0
simannaan gootota oromoo mana hidhaa mootummaa wayyaanee gadi lakkifamaniif taasifamaa jiru haala hoo'aan cimee fufee jira,0
