bareedinni dhiiraa gurraachummaa madaalamuu qaba,0
dhiiraa diimaa dhiiraa gurraacha wayya,1
dhiirri jimmaa garaa jaalata abbaa garaati,1
dhiirri dubartiif bakka hin qabu,1
dhiirri harargee jaartii hin bulchu ishiitu bulcha bultiin biratti hiikaa hin qabu barbadee fuudhee guyyaa 7ti hiika,1
dhiirri wallaggaa kokkolfaa,1
yaa shamarran dhugaan jedha bultii gaarii ijaarachuu barbaaddan dhiira maccaa tulumaa heerumaa,0
dhiirri wallaggaa tola,0
dhiirri shawaa farsoo araqee dhugduudha,1
dhiirri shawaa foolii farshoo qaba,1
qoyi dhiirri shawaa sammuun nagaa qabaa,0
dhiirri dubartii qabeenya qabdu fuudhe fincaa'uuf eeyyama niitiii gaafata,1
dhiirri jaalallee hin qabneef durbi durbummaa hin qabne seeratti dhihaachuu qabu,1
dhiira garee ijaaru dhiiri bultii ijaaru argun miilaa bakar waaree arguu taate,1
dhiirri baadiyyaa hojii hin danda'u,1
dhiirri bareeda shamarran hundaa suura maxxansan bultiif hin taatu,1
shamarran beektuudha,0
shamarran gubduudha,1
warri shamarranii warri qalloo taatan baga gammaddan,1
dhiirri bara suuraa qofa irraatti bareeda lafatti zeeroodha,1
dhiira shawaatiin dhungaatamu mannaa dhiira wallagaatiin ciniinamuu wayya,1
dhiirri shawaa warqiidhaa gatii jabeessa,0
facaafte haammatta durbummaa namaa hin balleessin,0
durbummaa shamarree tokkoo balleessitee durbummaa shamarree biraa hin eegin,0
durba qalloo hin fuudhinaa waraanti,1
dhiirra qallaa hin heerumin waraanaa,1
dhiirri addaggee muudiin galuuf koodha,0
dhiira gaarii hin barbaadu,0
shamarran biyya arbaa goota goota caaluu jabaadha,0
shamarran biyya arabaa haamilee shamarran tuquun dhaabbatu,0
shamarran arabaa abdii hin kutatinaa jabaadha mudhii hidhannee jabaannu,0
shamarran biyya arabaa dandeessu hunda obsituu,0
shamarri biyya arabaa warqiidha,0
shamarran biyya arabaa abaaruun dhaabbatu,0
shamarri dhiirri bara jaalata jettee amantu gowwaadha amani,1
dhiirri shamara bara amanu gowwaa gowwootaati,1
shamarran shawaa shamarri biraa jaalala hin beektu,1
sammuu shamarran biyya arabaa jirtu guutee qarshiidha jaalala dhiisanii jiru,1
shamarran dubaa'i jaalallee godhachuurraa gaalaa jaalachu woyya waaqa,1
dhiirri amala qaba tokkoffaa hunda fakkaachuu,1
dhiirri amala qaba lamaffaa sobee kakachuu,1
dhiirri amala qaba sadaffaa torba jaalachuu,1
shamarran biyya arabaa maaltu barbaadaa maaliif jettanii,0
shamarran biyya arabaa baayyee qaqqaaliidha,0
dhiirri bareedan amalli zeeroodha,1
dhiirri bareedu hojiin zeeroodha,1
dhiirri bareedu ilaalichi zeeroodha,1
dhiirri bareedu jireenyi zeeroodha,1
dhiirri fokkisaan wajjiin jiraachuuf ta'a,0
dhiirri bareedan wajjiin suuraa ka'uuf jireenyaaf hin,1
dhiirri eenyummaa beeku shamarran biyya arabaa hin qeequ,0
dhiirri fb barteef sareen qeeraa barte tokkuma,1
dhiirri shawaa hattuudha,1
dhiirri wallaggaa hattuudha,1
dhiirri kaayyoo qabu shamarran fb jaalalli hin qabu,0
shamarran fb hundii warqiidhaa,0
shamarran kaayyoo qabdu dhiira fb shooshiluu bultiif hin barbaaddu,1
shamarran biyya arabaa jirtaan dhiira biyya arabaa hin heeruminaa,0
dhiirri itoophiyaa jiraattan shamarran arabaa jiraatan hin fuudhinaa dhaamsa kooti,0
dhiirri oromiyaa warqiidha,0
dhiirri biyya arabaa carqiidha,1
shamarran dhaaba hin qabnee oromoo miti,1
shamarran bultiif taatu garee keechaa hin argamtu,1
shammarran biyya arabaa hundii warqiidhaa keessaattu shamarran dubaa'i,0
dhiirri sagalee qallaa durba fakkaata,1
durbi baadiyyaa xibaara baayyisti,1
durbi bareedduuf konkolaataan mana abbaa qarshii qabuuti,1
shamarran gabaabduu fuudhuurra fuudha dhiisu wayya muramte,1
durba furdoo fuuchuu mannaa dhiisu wayya muramte,1
durbi abbaa birriiti,1
shamarran qalloon bultiif hin taatu kalaas,1
xibaara dhiiraa durba booroo hin qabne nagaa hin gaafannu,1
dubraa qal'oo dheertuu gaafa arguu saandaallii se'ee aarsuuf deema,1
shamarran qal'oo hin fuudhinaa,1
dubartoota barnootan jajjabeessudhaaf qabxii barattoonni shamarranii sadarkaa tokkoo birootti darban dhiirarra gadi buusudhaan jajjabeessaa turan,0
shamarran dhiiraa gadi ta'anii hin hawaasa ilaalcha tureef miidhaa shamarran gaheef shamarran barnootarraa fageeffamaniif jajjabeessudhaan barnootatti cimaniif yaadameeti,0
dhiirri sobee kolfe sobee boo'u hin danda'u,0
shamarran bara dhiiratu safuu beeka,1
dhugaa jette shamarran bara anuma wajjiin safuu wallaalteetti,1
shamarran ammaa safuu oromoo hin beektu,1
shamarran beenxee keessaa kanumti durbummaa qabdu jirtiyii,1
shamarran durbummaa hin qabne guyyaa qaama miidhamtoota kabaaju qabdan,1
shamarran biyya arabaa daawwitiidha ilaalta,1
dubartii dhiirri dorgommiirratti sagalee wal fakkaatu argatan dubartiif carraan laatama jedhu wixinee labsichaarra taa'uus manni marichaa sagalee caalman kuffiseera,0
namoota har'a vaayirasiin koronaa irratti argame afranuu lammii itoophiyaa ta'an dhiira lamaa dubartii,0
shamarri fokkistuun jaalala dhugaa beekti,0
shamarri bareedduun jaalala hin beektu,1
shamarri rifeensa hin qabne hundi dhiiruma fakkaatti,1
shamarri durbummaa qabdu jiraatte badhaasa qabda,0
shamarraan shawaa safuu beektudha,0
shamarran shawaa biraa gad deemtudha,1
dubartii konkolaataan finfinnee dadhabnee lamaan isaanituu humnaa fe'uu jaalatu,1
shamarran tun maa waccii talbaa eelee,1
dhiirri biyya arabaa jiraatan bultiif hin taatanu nan sobee,1
dhiirri biyya arabaa safuu hin beeku addaggeedha,1
shamarran biyya arabaa fuudhaaf hin taatuu hin fuudhin qeerroo,1
shamarran gurraatti hin fuudhin qeerroo rifachiistii,1
shamarran wallaggaa hin fuudhinaa safuu hin beekanii,1
shamarran diimtuu gudeedii isheen shanyii kuush miti yaa qeerroo,1
shamarran gurraatti shanyii kuush ganamaa jaallaadha,0
shamarran bareedduu oromiyaa keessaa kamittin argadha,0
shamarran oromiyaa keessaa haraki caalu kamtu fb faayyadama,0
shamarran oromoo dhiirri habashaa hin fuune tolee,0
shamarran salaalee mi'oofti jedhan dhugumaa laata,0
dhiirri jaalala dhugaa beeku hin jiru soba,1
durba hin jaaladhu sobduu taatef,1
dhiirri furdaan bultiif hin,1
dhiirri areeda hin qabne hunduu shamarran fakkaata,0
dhiirri butiif baalee jira,0
dhiirri oromoo jaalala fudhachuu jaalala kennuu hin beeku,1
jaalattanis jibbittanis dhiirri shawaa gootas bareedas,0
dhiirri wallagaa maaliif akkanatti bareedduu gaaffii kooti,0
dhiirri bara birrii jaalala hin barbaadu,1
dhiirri bara bakka argatee hin bahu saree wayiidha,1
arabaattin heeruma jedheen qeerroo sodaadhee dhiise,0
dhiirri jimmaa warqiidha,0
dhiira jimmaa carqiidha,1
dhiirri maaliif shamarran godina biroo fuudhuu barbaaduu,0
dhiirri oromoo durbummaa jaalala hin barbaadu,0
dhiirri jimmaa sunsuma bunaati,0
warri durba maaliif sobdu,1
shamarran baayyee dhiira gurraacha jaalatu jedhama maaliif,0
dubartoonni hedduun dhiira gaarii dhabanii jiru sababni isaas dhiira gaarii adda baasuu dadhabaniif,0
dhiironnis dubartoota tokko tokko fakkeessu sobuu danda'u nama soba dhugaa addan baafachuu qabda,0
dhiirri dhugaan jaalatu jaalala kunuunsa agarsisa ykn jaalala kunuunsa godha,0
dhiirri sobaa walitti dhufeenyi irratti hunda'edha,0
shamarran qarshii furdaa horattu gatii hin qabdu,1
fuudhan durba gurraattii,0
durba diimtuun dhiira fakkaatti hin fuudhinaa,1
durba harargee durbummaa qabdu fuuchuun barbaada hayyee,0
dhiironni fuudhuu barbaadan durba baddallee fuudhaa,0
shamarran harargee qabdi 1ffaa kabaja qabdi,0
shamarran harargee qabdi lamaffaa bareedina uumama qabdi,0
shamarran harargee qabdi sadaffaa dubrummaa qabdi,0
durbummaa shamarran harargee miila bakar waaree hin argin hafnaa laata,1
shamarran harargee mootii jaalalaati,0
dhiirri kenni jedhee nagaaftu baayyee tola,0
dhiira wojjin wol bartan qabeenya maal qabda mana konkolaataa jettanii hin gaafatinaa,0
gaa'ila raawwattan dhiira jabeessaa harka lamaan qabadhaa,0
dhiirti mana urgaa'uu bakka bareedduu jaalata ta'eef hunda mana urgeessaa,0
dhiiraaf adurreen bakka ho'aa jaalatu hin qorrisiisinaa,0
dhiirti aarii hin jaalatu ta'eef hin aarsinaa jedhe hunda tole jedhaa,0
shamarran feete shooshili harargee fuudhi,0
dhalaa fuute yaabbattes rakko miti,1
dhalaa dubrummaa hin qabne fuute cidha keetitti maallaqa hin baasin obbooleessa,1
dhalaa funyaan qabdu hin hidhiin bareeddu fuudhi obbooleessa,0
dhalaa garbuun shukkumii jaalatti,0
dhalaa diimtuu walumaan qoosa hin fuudhinaa,1
dhiirti dubaa'i dhalaa waliin suuraa ka'uu daabboo nyaachu hin beektu,1
jireenya gaarii jiraachuu feeta taanan dhalaa shawaa fuudhi,0
bara dhalaa diimtuu gurraattii addaan wallaallee keessaa jirraam,0
dhiirri tiik tookii fayyadamtu hundi gowwaadha,1
dhiirri kaayyoo qabdu hin heeruma hin fuudhu,1
dhiirri kaayyoo qabdu shamarran shawaa shooshilee shamarran jimmaa fuuti,0
dhiirri kaayyoo qabdu shamarran shawaa fuudha,0
dhiirri kaayyoo qabdu shamarraniif kaardii guutaa oola,1
shamarran harargee hirriiba ganamaa nama gammachiisa jedhan,0
dhalaan kaayyoo qabdu dhiira addaggeetti heerumti,1
shamarran eebba haadha abbaa qabdutu dhiira gowwaati heeruma,1
shamarran harargee hundi isheetuu goota kabajatu malaaf,0
shamarran harargee rabbiin gaafa uumu harka dhiqateet uume oromoof qaaliidha,0
shamarran harargee hedduu miidhagan warqii oromooti jiraadha,0
shamarran oromoo hundi isheetuu warqiidha,0
shamarran harargee mootii jaalalati,0
gaafan du'u shamarran harargeetii waliin awwaala,0
gaafan du'e dhiira harargee waliin awwaala,0
dhugaa keeti shamarran harargee warqiidha maaltu gaha,0
dhiiraa amanaa fuudha feetan shamarran siyaasa bilisaa fuudhaa dhaamsa oromummaati,0
shamarran bareedduun hundi haadhoo kooti,0
harargee keessaa dhiira qofatu qaroomadha,1
shamarran harargee qaroomina hin qaban,1
dhiirri tokko obboleetti shooshiluu argite maal goota,0
namni fuungee fuudhe innuu malateera yaaddoo turaa wajjiin bara dheeraa,0
durba obboleettidha haadha manaadha hin arrabsin,0
shamarreen biyya arabaa jirtu tokkoon isheetuu kasaaraa hin qabdu,0
durbi biyya arabaa neetworkiin biyya sa'aatii jaha hin hojjetu,1
shamarreen harargee warqiidha,0
shamarran oromoo hundi warqiidha,0
shamarran jimmaa qaaliidha,0
dhiirri jimmaa warqii caaluu dhugaadha,0
amaaraa dubartiin ulfaa tokko waanuma hundaa kajeelu,1
shamarreen hiyyeesa jaalattu fiilmii qofarratti,1
dubartiin tokko umrii afurtamii shanii shantamii shanii qofa tajaajila kennitu,1
shamarran oromoo hunduu jaalala beekti,0
shamarri oromoo hundu jaalala beekti gandummaa dhiisaa,0
shamarran hin fuudhinaa shanyii arabaati isheen,1
dhiira gantuudha,1
shamarran kutattuudha,0
dubartiin gaariin dhiira gaariif uumamtee jedhan rasulli,0
yaa rabbii abbaa manaa gaarii haadha manaa gaarii waliif qoodii jannataa addunyaa akiraallee waliin badhaasi aamiin yaa rabbii yaa allaah,0
dhiirri baadiyyaa meeshaa guddaa qaba jedhu dhugumaa,0
dhiirri bara durba caalaa haadha ilmanii jaalatti,1
dubartoota qofaaf baga kabaja guyyaa kijibaa keessaniin gahe,1
shamarran saa'udii arabiyaa jirtaan dhiiraaf warqii bittan harmee keessaniif buna bittani,0
shamarran durbummaa hin qabne seeratti dhihaachuu qabdi,1
shamarran biyya arabaa jiran tokkollee durbummaa hin qabdu,1
shamarran biyyaa arabaati dhufte hunduu qalbii hin qabdu gori qeerroo,1
shamarraan arabaa taphaaf fuudhaaf hin taatu qeerroo,1
durbi durbummaa qabdu seeratti dhiyaattu,1
dubartoonni durbummaa hin qabne ajjeesaa,1
shamarran bareedduun oromiyaa keessaa baay'inaan kamitti argamti,0
durba durbummaa qabdun dhabe maal wayya,0
dubarri amanamtuun oromiyaa keessaa kamitti argamti laata,0
addunyaa kanarraa shamarran dubrummaa qabdu hin qabneettu hedduudha,0
shamarran garee amala gaarii qabaattanus namni durbummaa qabu hin jiru,1
jaalalli shamarran durbummaa hin qabne nyaata sooggida hin qabneeti jedhu dhugaadha,1
shamarran biyyaa arabaa durbummaa qabaatte ofin ajjeesa,1
shamarran durbummaa hin qabne seeratti nuf hadhiyaatani,1
filannoo bara 2012 irratti shamarran durbummaa qaban hin hirmaatan jedhame,1
ijoolleen biyya arabaa jiran durbummaa qabu jedhu,0
godinaalee oromiyaa hunda shamarran takka takka fuudhuun barbaada,0
shamarran maraatanii jiru dhugaa,1
dhiirri rifeensa mataa firiizii hin qabne hin bareedu,0
dhiirri hin jiru ta'ee taanaa turre dubartoonni,0
shamarran biyya alaa dhiirri biyya alaa warqiidha,0
dhiirri wallaggaa maaliif akkanatti jajanii,0
dhiirri jimmaa dhiirummaa hin guutuu caatii qama'uuf farsoo dhugdee fincaa'uu qofa,1
dhiirri wallaggaa maaloodha maaliif shaaffaduu baayyisti,1
dhiirri harargee maaliif akkan bareedu,0
yaa shamarran dhageessaa dhiirri wallaggaa bineensa adaraa jabeessaa,0
dhiirri bareedduun hundi jaarsa fakkaatti,0
dhiirri hindii dhiirri amaaraa takka jaalala nama qabsiisan beeku,0
dhiira amanuu adurreedhan aannaan eegi jedhanii manaa bahuudha,1
dhiirri maaliif durba sossobata,0
dhiirri bareedaniif dubartiin bareedduun baayyee carraan bultii hooratinii jiraachuu xiqqaadha,0
bakka ijoolleen durbaa hin jirre jiraachuurra hin dhalatin hafuu wayya,0
,0
ijoolleen durbaa maaliif dhiira bukkee ga'an hudduu mimicciiru,1
shamarran walloo yaa bareeda alagaaf kennu dabarsee,0
ganamaa qabee ammaatti durba durbummaa qabdu barbaadeen dhabe,1
dubartiin tokko dhiirri wayii nafsaala dheeraa qabuuf jajuu hin qabdu,0
shamarran biyya arabaa jirtu muxxeen jaraa abbaa hin qabdu,1
sababa nama tokkoon nama hunda hin xureessinaa dubarri saditti oolu tokkoffaa haadha keenyaa,0
sababa nama tokkoon nama hunda hin xureessinaa dubarri saditti oolu lamaffaa obboleetti keenyaa,0
sababa nama tokkoon nama hunda hin xureessinaa dubarri saditti oolu sadaffaa haadha manaa,0
dhiirri biyya arabaa jirtu hundi isheetuu kadhattuudha,1
dhalaan biyya arabaa jirtu hundi salamtuudha,1
dhiirri hin boo'u gumaa baasa,0
shamarran biyya arabaa keessaa harka meeqatu jaarsa qaba,0
addooyyeen hiriyummaa shamarran qarreeti,0
qarree dubara reefu geessu rifeensa guduruu haadhatte hinheerumin ykn walqunnamtii hineegaliini,0
addooyyeen aadaa shamarran oromoo jaalala dhugaa kabajaafi maalummaa hiriyummaa ittiin agarsiisaniidha,0
rakkoolee fayyaa finnisni fuularratti baay'achuu rifeensi mataa bubuqqa'uu dubartoonni amala dhiiraa agarsiisan taasisa jefhameera,0
amaloota dhiiraa shamarran agarsiisanis sagalee dhiiraa qabaachuu areeda biqilchuu marsaan laguu ciccituufi baduu dhibee tiruufi gadameessaa hammeessuu danda'a jedhan,0
dhiironni amala dubartootaa agarsiisuu harma guddachuu jijjiirama hormoonii agarsiisuufaa tauu eeran,0
durbi bareedina isheetti amantu gurdii uffatti,0
amani durbi durbummaa qabdu ogeettiidha kabaja aadaafii sodaa qabdi,0
durbi durbummaa hin qabne harree madaa fakkaatti,1
durba durbummaa qabdurra qalbii qabdu woyya,1
shamarri bara qullaa deemum bar,1
luqqa'uu garaachaa dhiirootaf sababni dubartoota,1
gubachuu somba dubartootaaf sababni dhiira ta'uus dabali,1
luqqa'uu garaacha dhiirotaaf sababni araqeedha,1
luqqa'uu garaacha dubartootaaf sababni buna,1
luqqa'uu booroo dubartootaaf sababni dhiirota,1
luqqa'uu somba dubartootaaf sababni dhiirota,1
dhukkubbii boo'icha dhiiratiif wanti sababa ta'uu danda'u dubartoota qofa,1
dhiirri durba durbummaa hin qabne fuudhe hattuudha,1
dhiiruma rabbi fixu,1
durba birrii qabdu durbummaa qabdu fb hin jirtu,1
durba durbummaa hin qabne kabajuu seexanatti sagaduun tokkuma,1
durba durbummaa hin qabne mana cufaa balbala hin qabneen tokkuma,1
beektonni jedhanitti durbummaan tokko tokko haala irratti hundaa'ee baduu danda'a,0
durbummaan parsantii sagaltamii sagal walqunnamtii saalaatiin bada,0
dhiirri durbummaa soqxuuf seexanni dhiiga barte tokkuma,1
durba durbummaa hin qabne dhukkee kaasudha,1
durba durbummaa hin qabne kireeffatte haadha manaa namaa fuudhuun yakka,1
durba obboleettidha,0
dhiira obboleessa abbaa manaadha hin arrabsin,0
shamarran oromoo kallattii hundaan jirtan jirtuu jirtan,0
dhiirri dhedheeraan warqiidha,0
dhiirri gabaabaan diyaamendiidha,0
durbi gaafa heermtu guyyaa tokko qofa boossi,0
dhiirri gaafa fuudhe bara jireenya boo'a,1
beekkamu baayee dhiiraa dubartiin baayeen walitti dhiyaatu kanneen karaan jaalalaa walitti dhufeenya dhiiraa durbaatiif baayee mijaayaa,0
dhiirri dubartii jaalatu dubartiinis dhiira jaalatti,0
durbaa harreen daftee fuula naanneffatti,1
shamarraan arrabsuun dhaabbatu,0
shamarran haadha obboleettidha haadha manadhas taatef arrabsuun dhaabbatu,0
dubarii herreegni goroggoraa jaalatu,1
durbi garaa guddaa ulfa fakkaatti,1
rakkoon shamarran keenyaa guddaan hojjetanii duroomuu dureessatti heerumuu filatu,1
shamarri hin heerumin durbummaa hin qabne nagaan boqadhu,1
shamarran bareedduu gaafa argituu uumaa ajaa'ibsiifadhu,0
durba durbumma hin qabne namni fuudhe warabessa sa'aa du'aa nyaateti,0
shamarran durbummaa hin qabne guyyaa ayyaana qaama miidhamtoota duuka kabajatan,0
shamarran durbummaa hin qabneef manni kiraa tokkicha dhugaa,0
durbi durbummaa hin qabneef manni furtuu hin qabne tokko,0
shamarran durbummaa hin qabne mana araqee waliin tokkuma,0
dubartoonni hin heerumin umriin 30 ta'e baddan michiin dhahe,1
warri shamarranii heerumuu barbaaddu taanan hidhii hidhii adurree hantuuta quuftee fakkeessitanii hin deemina,0
warri dhiiras fuudhuu barbaaddu taanan rifeensa bosona baalee fakkeesitanii hin deeminaa,0
obn hagayya 29 2011 shamarran 25 ogummaa moosaajiin leenji'an eebbifaman,0
obn 21 12 2010 talaallin ittisa kaansarii fiixee gadaamessaa shamarran umriin 14 ta'eef buufataalee talaallii manneen barnootaa dhaabbilee fayyaatti laatamu ta'uu ministeerri eegumsa fayyaa fdri beeksise,0
talaallin kaansarii fiixee gadaamessaa shamarran umriin 9 14 ta'eef laachun ittisarratti bu'a qabeessa ta'e ibsameera,0
bookoo haaraam shamarran 22 ukkaamsee fudhate,0
gareen shoororkeessaa bookoo haaraam nageenyaa naayijeeriyaa booreessaa jiru gandoota kaabaa baha biyyatti lamarraa shamarrann 22 umriinsaanii 17 gadii ta'aan ukkaamsee fudhachuusaa jiraatoonni naannichaa himan,0
jiraattoonnii naannichaa himanitti gareen bookoo haaraam shamarran keenyaa jalaa fudhachaa jiruu looltoota hadha warraa gochuufi jedhaniru,0
obn 22 03 2010 itoophiyaatti shamarran 76 waaee dhibee hiv adis hubannoo hin qaban jedhame,0
obn 01 09 2010 yunivarsitiin dursaa zaambiyaa barattoota dhiira dogoggorsuuf barattootni shamarree 'gar tokkee qullaa' uffachuun mana kitaabaa hin seenne jedheef dhiifama gaafate,0
baankiin addunyaa jedhutti haala ammaa fufe bara 2030tti dubartoonniifi shamarran qaama hawaasa hiyyummaa cimaa jiraatan jedhameera,0
obn 25 2013 barsiisaan biyya indiyaa tokko hojii barnoota shamarranii irratti hojjeteen badhaasa idil addunyaa barsiisotaaf qophaau injifate,0
obn mudde 04 2013 waldaan qajeelcha maatii itoophiyaa damee bahaa dhaabbilee deeggartootaa waliin mari'ate,0
hogganaan waldaa qajeelcha maatii itoophiyaa damee bahaa obbo nagaash seeyifuu dhaabbatichi deeggarsa namoomaa taasisaa turuu yaadachiisuun shamarran ciccimoo jajjabeessuuf badhaasa kennaa turuu himaniru,0
obn hagayya 08 2011 karoorri kittaannaa dubartootaa heeruma umurii dhabamsiisuuf bahe ifoome,0
obn adoolessa 27 2013 olompikii tookiyoo dubartoota meetira 800 irratti hirmaattee atileet habtaam alamuu 6ffaa bauun xumurteetti,0
olompikii tookiyoo dubartoota meetira 800 irratti hirmaattee atileet habtaam alamuu 6ffaa bauun xumurte jirti,0
obn hagayya 08 2013 jaarimiyaaleen dubartoota biyyaaleesaa gooticha raayyaa ittisa biyyaaf galaa qopheessuun dhiiga arjooman,0
pirezidaantiin federeeshini dubartoota biyyaalesaa aadde askalee lammaa ibsaanitti nageenyi biyyaafi daangaan biyyaa sarbamutti caalmaatti miidhaman dubartootaaf daa'imman ta'aniif nageenya biyyaa egsisuuf daangaa biyyaa kabachiisuuf adda durummaan tumsaniifi hirmaannaa dachaa qabanu dabartoota jedhanii,0
ammaattis jaarimiyaaleen dubartootaa sadarkaan jiru galaa qopheessuufi bifa adda addaatiin deeggarsa birii miliyoonatti tilmamamuu taasifneerra jedhanii guyyaa haraa galaa birrii 400fi 70 baasuufi dhiiga yuunitti 150 gumaachina jedhaan,0
gaafatamtuun waajjira liigii dubartoota paarti badhaadhinaafi aantuun pireezidantii liigii dubartoota paarti badhaadhina aadde meskerem abbebe dubartoonni ijaarsa biyyaa gahee bakka bu'insa hin qabaanne qabnuuf biyyarra rakkoo gahu qolachuuf daa'ima abbaa manaa isaaniifii ofis dabarsanii kennuun gaachana biyyati jedhaniiru,0
miseensonni jaarmiyaalee dubartoota biyyaaleesaa biyyi waamamtu dubartootaan fakkeefamtee ta'uunsaa dhimma biyyaarratti gahe dubartootaa dachaa ta'uu mulisa jedhanii,0
obn adoolessa 28 2013 pireezidaanti saahilawarqi zawdeen baadhafaman,0
ministeerri dubartoota maatiifi daaimmaani rippabliika dimookraatawaa koongoo badhaasaa guyyaa dubartootaa paan afrikaa waggaan lakkoofsa faranjoota adoolessaa 31 kabajamuu sababa taasisuun pireezidaanti saahilawarqi zawdee badhaasan,0
pireezidaanti saahilawarqi zawdeen badhaafamanis hojiilee dubartoota siyaasaan dinaagdeenifi hawaasummaan gaahomsuuf biyya afriikaafi idila addunyaatti hojjetaan tauus himameera,0
obn hagayya 12 2013 ciroo barmaatiileen miidhaa geessisan xinsammuu daaimmaan dubartoota miidhuu darbee rakkoo hawaasummaa taa jiru jedhame,0
akkaata barmaatiilee miidhaa geessisan hanbisuun dandaamu irraatti waajjirri dhimma dubartii daaimmaan dargaggoo godina harargee lixaa abbooti amantii abbooti gadaa haadhoolii siinqee qaamoolee dhimmi ilaallatu biroo waliin magaalaa cirootti mariate,0
barmaatiileen miidhaa geessisaan kanneen umrii heerumsiisuu kiittaannaa ijoollee dubara huuba qonqoo muruu kanneen biroo godina harargee lixaatti ammas jiraachuun yaaddessaadha jedhameera,0
gaafatamtuun waajjiira dhimma dubartoota daaimmaan dargaggootaa godina harargee lixaa aaddee asiliyaa ibrahiim barmaatiilee miidhaa geessisaan hanbiisuuf abbootiin gadaa abbootiin amantii qaamooleen biroo dhiyeenyaan hawaasa keessaatti barmaatiileen miidhaa geessisaan dubartoota daaimmaan irraatti rawwatamu argu taeef waliin marachuun barbaachisee jedhan,0
obn hagayya 01 2013 oloompikii tookiyootti waldorgommiin xumuraa fiigicha meetira 10 000 dubartoota har'a guyyaa sa'aatii 7 45 irratti eegala,0
dorgommii fiigichaa dubartoota kanan itiyoophiyaa bakka bu'an atileetota sadiidha,0
obn fulbaana 20 2013 waldaan dubartoota oromoo magaalaa finfinnee kantiibaa aantuu bulchiinsa magaalaa finfinnee aadde adaanech abeebeef kennaa uffata aadaa gumaacheera,0
obn ebla 13 2013 liigiin dubartootaa paartii badhaadhinaa oromiyaa konfaransii sochii filannoo bara 2013 geggeessuuf qophii xumuruusaa beeksise,0
liigiin dubartootaa paartii badhaadhinaa oromiyaa qophii konfaransii sadarkaa xumuree guyyaa boruu magaalaa adaamaa galma abbaa gadaatti sirna ho'aadhaan eegalu ta'uun himame,0
hoggantuun biiroo dhimma dubartootaa daa'immaniifi dargaggootaa oromiyaa aadde sa'aadaa usmaan ibsanitti waltajjiin konfaransii liigii dubartootaa sadarkaa naannootti geggeeffamu guduunfaa waltajjii konfaransii sadarkaa gandaarraa eegalee naannootti dubartoota miseensotaafi deeggartoota paartii badhaadhinaa ta'an miliyiona 5 hirmaachiseeti,0
uffata looltoota ertiriyaa uffachuun qabeenya uummataa saamani dubartoota gudeedan shiftoota juntaan uumee jedha bulchiinsi godina kaabaa tigraayi,0
obn 09 02 2011 fayyadamtummaa dubartootaa cimsuuf muudama carraa hojii uumuu diinagdeedhan danda'an gochuuf hojjetamaa jira dr abiyyi ahmad,0
obn waxabajjii 16 2013 dubartoota hoggansaaf gahoomsuun guddinaafi misooma biyyaa faayidaa guddaa qaba jedhan pireezidaanti sahilewarqi zawudee,0
pireezidaanti sahilewarqi waltajjii dhaabbanni dubartoota hoggansa siyaasa jedhufi dhaabbataa biyyoota gamtoominaatti barreessaa olaanaa aanaa waliin qopheessan irratti argamuun haasaa taasisanin dubartoota aangoof gahoomsuun guddinaafi misooma biyyaa faayidaa guddaa qaba jedhan,0
dubartoota aangootti fiduun dandaamuus dubartootaaf leenjii gaggeessummaa kennuu dubartoota aangoo jiranifi dubartoota birofis gorsaafi leenjii kennun dubarttoonni walii aadaa waldeeggaruufi waliin hojjechuu gabbisuu qabanif dubarttoonni carraa argataan hojjechuu dandaaan amanuun barbaachisadhas jedhan pireezidaantii sahileworqi,0
obn adoolessa 30 2013 gumiin dubartoota magaalaa roobee raayyaa ittisa biyyaatiif gala qopheessan miseensoti dubartootaa kunneen lukkuu haga lubbuutti qaban maraan gooticha raayyaa ittisa biyyaa cinaa dhaabbachuuf qophii tauu dubbataniiru,0
gootichi raayyaan ittisa biyyaa jaarmiyaa ijoolleen ijaarte utubuu qabna jedhan miseensoti gumii dubartoota magaalaa roobee,0
gaafatamtuun liigii dubartoota magaalaa roobee aadde alminash tsaggaa gumaatni godhaa jirru jalqabadha fuula duraatti fuufiinsaan kutaalee hawaasaa mara hirmaachisuun deeggaruuf qophiidha jedhan,0
filattoota filannoo galmaaan keessaa 54 dhiiroota 46 dubartoota tauu boordichi ibseera,0
obn adooleessa 28 2013 dubartootni jaarmiyaleen dubartoota bulchiinsa magaalaa galaan gootaa raayyaa ittisa biyyaaf dhiiga arjoomuun hidha guddicha haaromsa itoophiyaafis boondii bitan,0
gaafatamtuun dhimmaa dubartoota daa'immaniif dargaggoota magaalaa galaan addee dimbilaal kabbadaa magaalichatti raayya ittisa biyyaaf saangootaa deeggarsa maallaqaa garaa garaa tolchaa turree hardhas kanuma agrsiisaa jedhan,0
hojiin dubartoonni jijjirama biyya keessaa qabdu hin qabne jedhan kantiibaa aantuu bulchiinsa magaalaa galaan addee wenisheet gizaaw hawaasni magaalichaa goota rayyaa ittisa biyyaa hidha haaromsa dhiigaa lubbuu ofiitti ilmaan ergaa jiruu jedhan,0
daayirekterrii waajjira qindeessaa hirmaannaa uummataa hidha haaromsa guddichaa itoophiyaa nannoo oromiyaa aantuun pireezidaantii federeesheenii dubartootaa oromiyaa addee qonjiit baqqalaa birmadummaa biyyaa mirkananeessuuf raayyaa ittisa biyyaa hidhaa haromsaa guddichaa itubuu qabnaa jedhan,0
dubartootni magaalaa galaan dhiiga ajoomanii boondii bitataniis qaamaan deemuu baannes bakkuma jirruutti dandeennuun dirqama ba'aa jirraa jedhan,0
obn hagayya 23 2012 liigiin dubartoota paartii badhaadhinaa meeshaalee nyaata uffataa qulqullina eggachuuf oolan birrii miiliyoona 7 8 tilmamamu lammiilee miidhan gaheef deggarsa taasisan,0
liigiin dubartoota paartii badhaadhinaa liigii dubartoota badhaadhinaa finfinnee walin taun rakkoo nageenyaa ajjechaa artisti haacaaluu hundeessaa ilaalchise magaala shaashamannee magaaloota birootti muudateen lammiilee miidhan gaheef qindeessuummma miseensoota gaggeessitoota liigichaan maallaqa qaamoolee garaagaraa sassabameen meeshaaleen nyaataa uffannaa qulqullinaa eggachuuf oolan birrii miiliyoona 7 8 tilmamaman bulchinsaa magaala shaashamannee nageellef kennaniiru,0
